Nail Clippers, Nail File, Electric Nail Clipper, Electric Automatic Nail Clipper, Electric Nail Clippers For Adults, Seniors, Nail Clippers Electric, Automatic Nail Clippers, Electric Nail Trimmer, Christmas Gift;No URL;Not Ranked;Not Included;"30+ ";8.01;10
Electric Toothbrush Ultrasonic Cleaning Wireless Charging 5 Modes 6 Replacement Brush Heads Ipx7 Waterproof Protection For Dental Health With Travel Box For Home And Travel Use;No URL;Not Ranked;Not Included;0;17.20;17
1 Piece Rechargeable 304 Stainless Steel Multifunctional Electric Vegetable Chopper,350ml Easy To Carry,Food Processor And Chopper For Garlic, Pepper, Onion, Celery, Ginger, Meat,Kitchen Gadgets;No URL;Not Ranked;Not Included;0;12.80;3
Electric Meat Grinder Heavy Duty, 3000W Max Meat Mincer With 3 Stainless Steel Grinding And Sausage Stuffing Tubes For Home Use &Commercial;No URL;Not Ranked;Not Included;0;48.99;48
1pc English Language Wrist Blood Pressure Monitor With USB Cable, Adjustable Blood Pressure Monitor For Home Use, Large Screen Display And Voice Reporting, Measures Heart Rate, Powered By Lithium Battery;No URL;Not Ranked;Not Included;"10+ ";11.80;0
Costway 1000W Multifunction Portable Hand-held Steam Cleaner W/10 Accessories;No URL;Not Ranked;Not Included;"20+ ";54.98;44
Heating Pad For Period Cramps, Portable Menstrual Cordless Electric Heated Pads For Pain Relief With Massager Rechargeable Heating Pad Birthday Gifts For Mom Women Girlfriend;No URL;Not Ranked;Not Included;0;12.60;10
Household Induction Cooker, Intelligent Multifunctional Hot Pot And Stir Fry Cooker;No URL;Not Ranked;Not Included;0;41.50;3
Table Fan, Rechargeable Battery Operated Desk Fan With Auto Oscillation 90 Foldable Ultra Quiet 4 Speeds Light, Portable Air Circulator Fan With Hook, Wall Fan For Bedroom Home Desktop;No URL;Not Ranked;Not Included;0;32.39;40
LineHome Vacation Portable Black Mini Letter Fan With Battery For Summer;No URL;Not Ranked;Not Included;0;3.60;0
Nugget Ice Maker Countertop, 40lbs/24H, Pebble Ice Maker With Soft Chewable Ice, Self Cleaning Ice Machine, Stainless Steel With Touch Screen, Compact Design For Home Office Bar Party -Silver;No URL;Not Ranked;Not Included;0;231.33;28
1pc Portable Handheld Mini Fan With One-Speed Adjustment, Powered By Aa Battery, Suitable For Outdoor Activities;No URL;Not Ranked;Not Included;"1.600+ ";2.97;1
1Pc Portable Mini Hand Clip Fan USB Charging Quiet Desktop Electric Fan  Student Dormitory Small Cooling Ventilador Fans;No URL;Not Ranked;Not Included;0;7.08;40
2-in-1 Hair Straightener Flat Iron, Straightener and Curler for All Hairstyles,LCD 248°F-392°F,60 minute timed shutdown,17 gear temperature regulation;No URL;Not Ranked;Not Included;0;12.76;45
6 In 1 Hair Dryer Brush Blow Dryer Brush Curling Wand Set;No URL;Not Ranked;Not Included;0;47.90;52
Cooluli 10L Mini Fridge For Bedroom - Car, Office Desk & College Dorm Room - 12v Portable Cooler;No URL;Not Ranked;Not Included;0;79.99;0
1pc Multicolor Innovative USB Rechargeable Octopus Mini Fan - 3 Speeds, Wearable & Multi-Functional - Ideal For Stroller, Outdoor, Table, & Necklace - Ultra-Portable Cooling Companion;No URL;Not Ranked;Not Included;"10+ ";6.20;0
Portable Multi-Function Car Vacuum Cleaner Large Suction Wireless Charging Small Handheld High Power Powerful Vacuum Cleaner In The Home Car Special;No URL;Not Ranked;Not Included;"10+ ";17.40;0
Impress Impress Mighty Mite 10-Inch Oscillating Portable Standing Fan With Metal Blades;No URL;Not Ranked;Not Included;0;42.99;9
1pc Portable Range Hood For Cooking,  Portable Kitchen Exhaust Fan, Portable Exhaust Fan For Kitchen, Desktop Range Hood, Portable Range Hood For Kitchen, Portable Kitchen Hood Vent;No URL;5;in Exhaust Fans;0;26.40;0
CRASTS Star MD-15 Foldable Hair Dryer With Concentrator Nozzle, Low Noise High Power Cold And Hot Airflow 3-Speed Settings 12m/S 17000r/Min Black, Suitable For Home And Salon Use;No URL;Not Ranked;Not Included;"10+ ";16.50;0
1pc Rechargable 500mAh Smooth & Shiny Nails Instantly - Electric Nail Grinder, Mini Manicure Pen & Multi-Head Grinder Set;No URL;Not Ranked;Not Included;"10+ ";11.34;10
Hair Dryer Diffuser Attachment For Curly And Natural Wavy Hair, Fit With Nozzle Diameter 1.35-2 Inches And 90%+ Hair Dryer Designs On The Market, Black Friday;No URL;5;in Hair Dryers;0;4.30;4
IPL Laser Hair Removal, Upgraded To 999,900 Flashes, 9-Position Adjustment, Permanent Hair Removal For Home Use, Full Body Treatments For Face, Legs, Arms And Bikini Line (Ai-12);No URL;Not Ranked;Not Included;0;53.54;20
3-In-1 At-Home IPL Laser Hair Removal Device - Laser Hair Removal With Cooling For Women & Men - 9 Levels Upgrade & 999900 Flashes For Face, Armpit, Arm, Bikini Line, Leg & Whole Body;No URL;Not Ranked;Not Included;"50+ ";58.70;0
1pc Manual Coffee Grinder, Portable Hand Crank Coffee Bean Grinder, Hand Grinding Coffee Machine with Adjustable Ceramic Core;No URL;Not Ranked;Not Included;"20+ ";10.35;10
Mini Donut Maker- Donut Maker Machine For Home -16 Small Donut Maker,Electric Non-Stick Surface Makes For Kids Donut Maker, Makes Doughnuts White;No URL;Not Ranked;Not Included;0;44.19;43
CRASTS Star Maker 32mm/25mm Quick Heat Up One Button Switch Large Wavy Curling Wand 1039, Suitable For Home Or Travel;No URL;2;in Hair Curling Irons;0;12.10;0
LARGNER Portable Mini Shaver For Men, Electric Razor Waterproof For Full Body Wash, USB Rechargeable With Long Battery Life, Great Father's Day Gift;No URL;Not Ranked;Not Included;0;3.30;3
1pc UV LED Nail Lamp , Professional Nail Dryer Gel Polish Light, UV Nail Light With 3 Timer Setting, Nail Polish Curing Gel LED Dryer, Professional Nail Art Tools With Automatic Sensor, LCD Display;No URL;Not Ranked;Not Included;0;8.60;0
Pronto Digital Multifunction Kitchen And Food Scale;No URL;Not Ranked;Not Included;0;21.21;40
Meat Slicer 200W Electric Deli Food Slicer, 0-15mm Cutting Capability, Meat Slicer, Adjustable Thickness For Home Use, Easy To Clean, Cuts Meat, Bread And Cheese;No URL;Not Ranked;Not Included;0;72.68;5
Rechargeable Electric Toothbrush - Waterproof, Automatic, USB Charging, Replaceable Brush Head;No URL;Not Ranked;Not Included;0;6.00;0
Roll On Wax, Wax Roller Kit For Hair Removal, Honey Roller Waxing Kit Include 2 Honey Soft Wax Cartridge & 100 Non-Woven Wax Strips, Portable Pink Wax Heater Machine For Women & Men, Waxing Roller Kit Depilatory Wax For Sensitive Skin;No URL;Not Ranked;Not Included;"100+ ";17.10;0
Roll On Wax, Wax Roller Kit For Hair Removal, Roller Waxing Kit Include 2 Soft Wax Cartridge & 100 Non-Woven Wax Strips, Portable Pink Wax Heater Machine For Women & Men, Waxing Roller Kit Depilatory Wax For Sensitive Skin;No URL;Not Ranked;Not Included;"60+ ";17.10;0
Handheld Fan Rechargeable, Mini Portable Fan Small Hand Fan, 3000mAh Battery Operated 22Hrs+ Makeup Eyelash Fan Personal Fan Gifts For Women Girls Men Travel Indoor Outdoor (Black);No URL;Not Ranked;Not Included;0;15.98;40
12 Volt Refrigerator 12V Car Fridge 42 Quart Portable Freezer Compressor Cooler Compressor Freezer, 12/24V DC 110~240 Volt AC, -4℉~68℉ For Truck RV SUV Home Use;No URL;Not Ranked;Not Included;0;161.27;28
Electric Hair Trimmer The Broken Hair Fork End Trimming Can Charging The Ropeless Hair End Cutting Machine For Home Use Of A Split -End Trimber;No URL;Not Ranked;Not Included;"40+ ";18.65;16
3L Hot Pot Cooker Skillet Steamer - Multifunction Frying Pan 110V Non-Stick Grill Stir-Fried Stewed Cookware Steak Noodle Ramen Shabu Shabu Pot - Home Office Party Kitchen Dorm Cooking White;No URL;Not Ranked;Not Included;0;50.27;37
Automatic Hair Repair Split End Remover Trimmer, For Dry, Split Ends, Damaged And Brittle Hair, Hair Grooming Tool For Men And Women, Portable USB Hair Cutting Tool, Automatic Electric Hair Clipper, Ideal Gift For Women On Special Occasions;No URL;Not Ranked;Not Included;0;17.50;0
YONGSTYLE Wooden Tortillera Press Set Include 1 Mexican Tortillera Presser 10 Inch Rotatable Tortilla Press Maker 200 Parchment Paper 1 Wood Cutter With Accessories For Mexican Taco Round;No URL;Not Ranked;Not Included;0;39.03;40
3 In 1 Breakfast Sandwich Maker Nonstick Panini Press Waffle Maker Bubble Waffle Egg Electric Grill With Non-Stick Coating & Removale Plates;No URL;Not Ranked;Not Included;0;43.10;41
Hanging Neck Fan Usb Portable 5-Gear Adjustable With Digital Display Mini Portable Small Lazy Person Hanging Neck Neck Leafless Rechargeable 360° Adjustable Refrigeration Air Conditioning Outdoor Student Mute Large Wind Fan Cooling Artefact Gift/Vale;No URL;Not Ranked;Not Included;0;10.40;5
1pc 1.2m Zinc Alloy 3-In-1 USB Charging Data Cable, Compatible With Huawei, Android, And Apple Devices;No URL;Not Ranked;Not Included;0;2.77;13
1pc Lovely Portable Humidifier, USB Desktop Humidifier With Color Lights, Cold Mist Mute Ultrasonic Fragrance Diffuser, Suitable For Cars, Offices, Bedrooms;No URL;Not Ranked;Not Included;0;8.30;0
CRASTS Big Diameter 40mm Curling Iron HC-010, Violet, For Quick Heat-Up And Big Wavy Style, Suitable For Home, Travel, And Salon Use.;No URL;Not Ranked;Not Included;"60+ ";18.20;0
1 Piece Automatic Curling Lron, Electric HeatedHair Curler, Automatical Rotating Curling LronsPortable Heated Hair Styling Tool For Home,Salon, Barbershop, Beauty Products;No URL;Not Ranked;Not Included;"200+ ";25.70;4
Car Wireless Mini Vacuum Cleaner, 12000pa USB Charging Handheld Car Vacuum Cleaner, Multipurpose Dust Cleaner, Dust Remove Cleaning Tool For Car Home Use,High Power With Fast Cahrge Tech,Portable Vacuum With Large-Capacity Battery;No URL;Not Ranked;Not Included;0;23.99;40
1300W GDOR JE2105 Juicer with Larger 3.2” Feed Chute for Whole Fruits and Veggies, Titanium Enhanced Cut Disc, Full Copper Motor Heavy Duty Centrifugal Juice Extractor Machines, Dual Speeds, BPA-Free, Silver.;No URL;Not Ranked;Not Included;"20+ ";89.99;38
1pc Blue Practical And Portable Adjustable Telescopic Back Scratcher With Pocket Clip Manual Massager Kit Handheld Tool;No URL;Not Ranked;Not Included;0;4.40;0
Professional Electric Nose Hair Trimmer Km-313 3 In 1 Sideburns Knife Head Eyebrow Trimming Nose Hair Shaver Nose Hair Trimmer;No URL;Not Ranked;Not Included;0;11.40;0
VNIMTI Mini Skincare Fridge, Portable Cosmetic Fridges With Makeup Mirror, Cooler & Warmer, AC & DC, Small Refrigerator For Bedroom, Car, Office, Outdoor;No URL;Not Ranked;Not Included;"10+ ";55.99;7
Camping Fan, 2-In-1 Rechargeable Camping Fan And LED Lantern With 270° Rotation And Built-In Hook For Camping;No URL;Not Ranked;Not Included;0;23.95;20
Cotton Candy Machine Kit - Red Sugar Candy Maker, Effortless Home Cotton Candy Maker Machine with Comprehensive User-Friendly Guide, Ideal for Parties & Fun Gatherings;No URL;Not Ranked;Not Included;"10+ ";60.84;33
6.5QT Air Fryer Oven, 8-In-1 Stainless Steel Air Fryer With Digital Touchscreen;No URL;Not Ranked;Not Included;0;49.68;28
KEMEI Professional Electric Cordless Hairdresser, Razor, Long-Life High-Speed Motor Power, USB Data Line Straight, Plus Three Limit Combs And Cleaning Brushes, Home Haircuts, Small And Portable, Holiday Gifts, Men Only, Applicable To Travel;No URL;8;in Hair Clippers;0;17.80;0
LARGNER Mini Electric Shaver,Electric Shaves For Men,Alloy Body,25 Small Blades,6500RPM Motor,Type-C Charging Use For 45 Days,IPX7 Waterproof,Travel Shaver,Uitable For Home,Car,Trave;No URL;Not Ranked;Not Included;0;7.80;4
Electric Men's Razor, Mini-Shave Electric Shaver For Travel & Camping, Portable Beard Trimmer Shaving Machine Hair Clipper Facial Epilator, Perfect Father's Day & Friend Gift!;No URL;Not Ranked;Not Included;"20+ ";11.30;0
1 Pc -50°C~550 °C  Household Handheld Infrared Thermometer Digital Non-Contact IR Temperature Sensor Pyrometer Professional Tool For Home Use, Cooking, Appliances Reparing (Battery Not Included);No URL;Not Ranked;Not Included;0;10.70;0
2 PCS Washer Door Striker 131763310 Replacement Part Compatible for Frigidaire & Kenmore Washers Machine, Replaces 131763300 AP3580441 PS890617 1032664;No URL;Not Ranked;Not Included;0;5.98;26
INSE Stick Corded Vacuum Cleaner, 18KPA Powerful Suction with 600W Motor, 3-in-1 Handheld for Pet Hair Hard Floor Home;No URL;Not Ranked;Not Included;"90+ ";56.00;63
1pc 999,990 Flashes IPL Epilator For Women Body Pubic Bikini 5 Gears Photoepilator Laser Hair Removal Pulses Depilator Home Use Device Remover;No URL;9;in Laser Hair Removal Devices;0;34.80;0
1 Pc Portable Air Compressor Air Pump, 150PSI Air Pump For Swimming Rings, Balloons, Air Mattresses, Balls, Tires, Air Beds, Inflation Electric Air Pump With Accurate Digital Pressure Gauge LCD Display, With Emergency LED Light;No URL;Not Ranked;Not Included;"10+ ";16.35;27
IPL Laser Hair Removal With Cooling System, Upgraded To 999,999 Flashes, 3 Functions, 9 Energy Levels, Painless Hair Remover, Full Body Treatments For Face, Legs, Arms And Bikini Line (Ai-10);No URL;Not Ranked;Not Included;0;68.00;20
1pc Food Thermometer Coffee Thermometer Stainless Steel Coffee Pot Thermometer Milk Frothing Pitcher Accessory Clip-On Dial Probe Metal Pointer Temperature Gauge For Hand Drip Coffee Home Supplies;No URL;Not Ranked;Not Included;0;3.31;23
1pc Modern Smart Floating Lamp Creative Luxury Gift Home Decor;No URL;Not Ranked;Not Included;0;12.48;40
2pcs Electric Salt And Pepper Grinder Set, Salt Or Pepper Grinder, Adjustable Coarseness, Battery Operated, With LED Light, One-Hand Automatic Operation, Stainless Steel;No URL;Not Ranked;Not Included;0;20.40;0
Massage Chair Recliner With Zero Gravity, Full Body Massage Chair With Heating, Bluetooth Speaker, Airbags, Foot Roller, Touch Screen, Space-Saving For Office,Faux Leather (Black);No URL;8;in Massage Chair;0;584.64;28
PrettyCare Stick Vacuum Cleaner, 6 In 1 Lightweight Cordless Vacuum Cleaner With Powerful Suction, 180° Bendable Wand Rechargeable House Vacuum For Home Hardwood Floor Pet Hair;No URL;Not Ranked;Not Included;0;84.66;28
Double-Layer Anti-Scald Stainless Steel Electric Kettle With Auto Shut-Off Feature, Small Capacity For Home Use;No URL;Not Ranked;Not Included;0;21.70;0
Full-Automatic Portable Washing Machine, 17.6Lbs Capacity Portable Washer With Drain Pump, 10 Wash Programs/LED Display/8 Water Levels/Faucet Adapter, 2.3 Cu.Ft Full-Automatic Compact Laundry Washer For Apartment, Dorm, Rvs;No URL;Not Ranked;Not Included;0;162.82;22
1pc 1800mah Rechargeable Vacuum Cleaner For Household And Car Use, Suitable For Indoor And Outdoor Use All Year Round;No URL;Not Ranked;Not Included;"20+ ";20.70;3
2pcs Disposable Hand Warmer, Adhesive Body Warmer For Winter Outdoor Activities, Natural Scent-Free, Air Activated;No URL;Not Ranked;Not Included;0;1.02;40
INSE N5T Cordless Vacuum Cleaner, 6 In 1 Rechargeable Powerful Lightweight Stick Vacuum With 2200 MAh Battery For Home Hard Floor Carpet Pet Hair;No URL;10;in Vacuum Cleaners;0;89.00;44
Portable Battery-Powered Men's Nose Hair Trimmer;No URL;Not Ranked;Not Included;0;2.50;0
Bottom Loading Self Cleaning Water Dispenser For 3 Or 5 Gallon Bottles,Stainless Steel Water Dispenser With 3 Temperatures-Hot, Cold & Room Water, Anti-Scalding Design And Child Safety Lock;No URL;Not Ranked;Not Included;0;169.99;0
LUCKYERMORE 2.6 Cu.Ft. Mini Fridge With Freezer Compact Refrigerator Single Door Adjustable Thermostat Removable Shelves Reversible Dorm;No URL;Not Ranked;Not Included;0;189.99;30
6 In 1 Foldable Hair Styler Set Hair Dryer Brush Blower High-Speed Negative Ionic Hot Air Brush With Interchangeable Brush Head Hair Dryer Comb For Fast Drying Curling Volumizing Straightening;No URL;Not Ranked;Not Included;0;57.70;0
1Pc Portable Mini Hand Clip Fan USB Charging Quiet Desktop Electric Fan  Student Dormitory Small Cooling Ventilador Fans;No URL;Not Ranked;Not Included;"20+ ";7.62;40
1pc Portable Mini Hair Straightener Flat Iron Hair Curler For Men Women Short Hair Wave Hairstyling Dual Voltage Straightening Irons;No URL;Not Ranked;Not Included;"100+ ";9.70;0
Unbeatablesale J-15 WHT Citrus Squeezer;No URL;Not Ranked;Not Included;0;59.66;0
[New Arrival] Stainless Steel Accurate Kitchen Electronic Scale For Home Food Weighing, Baking, Small And Compact;No URL;Not Ranked;Not Included;0;4.45;50
1pc Dual-use Hair Straightener And Curler With Plug, 4 Adjustable Temperature Settings And Negative Ion Hair Care Function;No URL;8;in Hair Straightening Irons;0;14.00;0
Steam Cleaner With 21 Accessories, Steamer For Cleaning, 5 Minutes Fast Heating, Portable Canister Steamer For Floors, Carpet, Cars, Tiles, Grout Cleaning, Chemical-Free, 1.5L Capacity (Guncolor) HK019;No URL;Not Ranked;Not Included;0;99.99;41
TASVAC Cordless Robotic Pool Cleaner, Automatic Pool Vacuum, 100-140 Mins Runtime, Powerful, Self-Parking, Lightweight, Ideal For Flat Above/In-Ground Pool Up To 80 Feet/2000 Sq.Ft;No URL;Not Ranked;Not Included;0;495.88;28
3-In-1 Evaporative Portable Air Cooler With 3 Modes Include Remote Control-White;No URL;Not Ranked;Not Included;"10+ ";100.99;38
Mini Cute Desktop Dust Vacuum Cleaner, Desktop Cleaner, Portable Corner Table Vacuum Cleaner Mini Cute Vacuum Cleaner Dust Sweeper;No URL;Not Ranked;Not Included;0;10.50;0
Gevi 5 Cups Small Coffee Maker, Compact Coffee Machine with Reusable Filter, Warming Plate and Coffee Pot for Home and Office;No URL;Not Ranked;Not Included;"40+ ";23.59;41
YONGSTYLE Mini Fge,20L Compact Skincare Fge, 60W Portable Cooling and Heating Refrigerator for Skincare, Foods, Medications, Bedroom, Office & Car, black;No URL;Not Ranked;Not Included;0;138.29;34
1pc Insect Trap Handy Scoopers, Bug Catcher Set Insects Scissors, Outdoor Portable Insects Catcher Tongs Light Tweezers;No URL;Not Ranked;Not Included;0;0.96;40
Waffle Maker, 1400W Double Belgian Waffle Iron 180 , 8 Slices, Rotating & Nonstick Plates, Removable D Tray For Easy Cleaning, Cool Touch Handles, Space Saving Storage, Black;No URL;Not Ranked;Not Included;0;64.01;36
1pc Electric Toothbrush For Adults, Ultrasonic Toothbrushes With 8 Brush Heads, Rechargeable Electronic Toothbrush, Comes With A Travel Box White, 8 Replacement Heads,Replacement Head Can Be Used For 2 Years,Sensitive Gums And Teeth Special Soft Toothbrush;No URL;Not Ranked;Not Included;0;22.70;0
Rechargeable Cordless Split Hair Trimmer, Hair Split Ends Trimmer, Remover Damaged Hair, Repair Hair Care Treatment, Portable USB Rechargeable Split Ends Hair Clipper For Household, Hair Trimming Device, Hair Care;No URL;Not Ranked;Not Included;"50+ ";16.40;9
1pc Portable Mini UV LED Nail Lamp With USB Cable, Egg Shape Design Nail Dryer Fast Drying;No URL;Not Ranked;Not Included;0;2.30;0
Multifunctional 6-In-1 60000rpm High Power Hair Dryer Negative Ions Do Not Damage Hair Hot Air Comb;No URL;Not Ranked;Not Included;0;44.90;0
Wireless Home Cleaning & Car Vacuum Cleaner, Handheld Cordless Vacuum Cleaner For Car Interior, Home, Kitchen, Keyboard, Sofa And More.;No URL;Not Ranked;Not Included;"10+ ";17.02;33
WANAI Retro Mini Fridge Compact Refrigerator with Freezer 3.2 Cu.Ft Classic Refrigerator 2 Door Mini Refrigerator Adjustable Removable Glass Shelves & Drawer Suitable for Dorm Garage and Office;No URL;Not Ranked;Not Included;0;199.99;23
Portable Solar Panel Powered Fan Rechargeable Battery With 2 Lights Fans Quiet Height Adjustable USB Floor Fan For Outdoor Trave;No URL;Not Ranked;Not Included;0;34.70;2
YONGSTYLE 3D Shiatsu Heated Massager: Deep Tissue Kneading Pillow For Neck, Back, Shoulder, Leg, And Body - Muscle Pain Relief For Home, Office, And Car - Perfect Holiday Gift;No URL;Not Ranked;Not Included;"10+ ";46.82;9
eufy Clean by Anker, Clean G40Hybrid+, Robot Vacuum, Self-Emptying, Robot Vacuum and Mop, 2,500Pa Suction Power, WiFi Connected, Planned Pathfinding, Ultra-Slim Design, Perfect for Daily Cleaning;No URL;Not Ranked;Not Included;"50+ ";379.99;12
Cordless Hair Straightener, Usb Charging Portable Mini Ceramic Curling Iron, 3 Levels Of Adjustable Temperature, Perfect For Travel;No URL;Not Ranked;Not Included;"30+ ";16.10;0
TASVAC Portable Carpet & Upholstery Cleaner Machine, Spot And Stain Deep Cleaner With Two Brushes & Remover Formula For Pets, Stairs, Couch Area Rugs, Upholstery, Car Seat, C7-Purple;No URL;Not Ranked;Not Included;"10+ ";90.74;28
Rechargeable Cordless Split Hair Trimmer, Hair Split Ends Trimmer, Remover Damaged Hair, Repair Hair Care Treatment, Portable USB Rechargeable Split Ends Hair Clipper For Household, Hair Trimming Device, Hair Care;No URL;Not Ranked;Not Included;"30+ ";16.40;9
3-In-1 Waffle, Omelet, Egg Waffle Maker, 3 Removable Nonstick Baking Plates, Upgraded 360 Rotating Belgian Maker;No URL;Not Ranked;Not Included;0;64.01;42
1Pc New 5 In 1 Electric Hair Dryer Hot Air Brush Multifunctional Hair Straightener Negative Ion Curler Blow Dryer Styling Tool Set;No URL;Not Ranked;Not Included;0;13.14;40
6 Quart Electric Pressure Cooker: 9-In-1 Multi-Cooker, Pressure Cooker, Slow Cooker, Rice Cooker, Steam, Saut, Yogurt Maker, Warmer & Sterilizer, Programmable Pressure Cooker With 24H Delay Timer;No URL;Not Ranked;Not Included;0;74.58;15
Ihomekee Espresso Machine, 3.5Bar Espresso and Cappuccino Machine with Preheating Function, 4 Cup Coffee Maker with Milk Frothing Function and Steam Wand;No URL;Not Ranked;Not Included;"10+ ";39.99;57
MCPR120A 8 Quart Digital Pressure Cooker With 13 Pre-Set Multi Function Features, Stainless Steel;No URL;Not Ranked;Not Included;0;87.79;34
Portable Salon Ion Aqua Foot Bath Beauty Kit Ionic Detox Foot Bath Spa MACchinne;No URL;Not Ranked;Not Included;0;73.99;40
Wireless Portable Car Vacuum Cleaner With Super Suction Power Rechargeable Handheld Home & Car Dual-Use Vacuum Cleaner Wet & Dry Pet Hair Cleaner;No URL;Not Ranked;Not Included;"20+ ";27.40;0
Portable Neck Fan, Hands Free Bladeless Fan, 4000 MAh Battery Operated Wearable Personal Fan, Leafless, Rechargeable, Headphone Design,3 Speeds Gifts For Women Men-Dark Green;No URL;Not Ranked;Not Included;0;38.99;40
1pc Multifunction 2 In 1 Electric Curler Hair Curling Iron Hair Straightener Heated Roller Professional Hair Styling Tools;No URL;Not Ranked;Not Included;"80+ ";7.90;0
New Foldable And Extendable Dual-Head Mini Fan For Desk, USB-Powered Portable And Compact Fan;No URL;Not Ranked;Not Included;0;5.46;40
Poweart Cordless Vacuum Cleaner, 30Kpa Powerful Stick Vacuum Up To 45 Min Runtime, 8 In 1 Vacuum For Hardfloors Pet Hair Home-V870 Blue;No URL;Not Ranked;Not Included;0;101.78;28
25/28/32mm Ceramic Coating Curling Iron Wand With 360 Degree Swivel Cord, Suitable For Short, Medium & Long Hair, Dry Or Wet Hair, Creating Various Classic Curls.;No URL;Not Ranked;Not Included;"30+ ";5.95;50
3-In-1 At-Home IPL Laser Hair Removal Device - Laser Hair Removal With Cooling For Women & Men - 9 Levels Upgrade & 999900 Flashes For Face, Armpit, Arm, Bikini Line, Leg & Whole Body;No URL;Not Ranked;Not Included;"10+ ";58.70;0
Car vacuum cleaner, handheld wet and dry vacuum cleaner, wireless car home dual-use high-power vacuum cleaner and dust blower;No URL;Not Ranked;Not Included;0;15.66;17
1 Rechargeable/Battery Powered Electric Toothbrush With 6 Brush Heads;No URL;Not Ranked;Not Included;0;3.20;0
Desk Fan Oscillating Bladeless Fan,Portable Small Tower Fan Electric Quiet Fan With Dual Air Circulation,Personal Cooling Fan With Cool Air Usb Bedside Fans For Home Office Bedroom Desktop;No URL;Not Ranked;Not Included;0;14.20;0
Wireless Handheld Vacuum Cleaner - Portable High Power Cordless Mini Car Vacuum Cleaner For Home Pet Hair Car Cleaning,Powerful Suction & Durable Body Portable USB Rechargeable(Red);No URL;Not Ranked;Not Included;0;31.60;0
1pc Mini Electric Heated Eyelash Curler, New Model, Portable Design, Black Color, Fast Heating, Long-Lasting Curls, Suitable For Daily Makeup, Holidays, Essential Beauty Tool, Precise Temperature Control, Protects Lashes Without Damaging Hair, Suitable For Beginners And Professional Makeup Artists;No URL;Not Ranked;Not Included;0;9.40;0
Compact Twin Tub With Built-In Drain Pump 14.3(7.7 6.6)Lbs Semi-Automatic Gray Cover Washing Machine;No URL;Not Ranked;Not Included;0;143.99;26
1pc Titanium Flat Iron With Adjustable Temp(290°F-450°F), 1 Inch Plate For All Hairstyles Hair Straightener Irons;No URL;Not Ranked;Not Included;"100+ ";27.97;44
1pc Hair Clipper For Men, Rechargeable Electric Professional Grooming Cutting Kit, Mustache T Blade Liners Trimmer Electric Shavers, Cordless Hair Clippers Barber Supplies For Body Face Mustache Grooming, Gifts For Men;No URL;Not Ranked;Not Included;"100+ ";13.50;4
【US】ANGENIL Professional  Titanium Flat Iron Hair Straightener and Curlers 2 in 1, Straightening Curling Hair Styling Irons for Women All Hair Types, Fast Heating, 1 inch Dual Voltage Travel Flat Iron, 360° Swivel Cord;No URL;Not Ranked;Not Included;"400+ ";27.40;0
Digital Display Automatic Car Air Compressor Pump, Suitable For Basketball, Bicycle, Motorcycle, Inflates Automatically Stop When It's Full;No URL;Not Ranked;Not Included;0;16.14;40
Women's Electric Eyebrow Shaper Portable Mini Electric Eyebrow Shaper New Shaver Battery Eyebrow Shaper;No URL;Not Ranked;Not Included;0;5.70;14
YONGSTYLE Portable Camping Fan with Lights, 20000mAh Detachable Rechargeable Battery Operated Fan, Battery Powered Outdoor Tent Fan with 4 Speeds & Hook, Personal USB Table Fan for Camping Accessories;No URL;Not Ranked;Not Included;"10+ ";53.44;22
Mini Portable Fan Handheld Fan, 3 Speed USB C Rechargeable Battery Operated Mini Pocket Personal Lash Fan With Lanyard Base Cooling Desk Fan For Kids Girls Women Travel Indoor Outdoor Black;No URL;Not Ranked;Not Included;0;15.99;40
YONGSTYLE Select Stainless Digital Rice & Grain Multicooker, Rice Cooker 4 Cup uncooked;No URL;Not Ranked;Not Included;0;105.45;25
GDOR SJ-017 Cold Press Juicer With 3.5” Feed Chute, Tritan Material, Powerful 100NM Motor Slow Juicer Machines, Heavy Duty, Masticating Juice Extractor Fits Whole Fruits & Veggies, Easy To Clean, Cool Grey.;No URL;Not Ranked;Not Included;"10+ ";79.99;38
