1pc Rechargeable Deep Tissue Muscle Handheld Massage Gun, Suitable For Body, Back And Neck Pain, Ultra-Compact Elegant Design, High-Torque Driven Massager;https://us.shein.com/1pc-Rechargeable-Deep-Tissue-Muscle-Handheld-Massage-Gun-Suitable-For-Body-Back-And-Neck-Pain-Ultra-Compact-Elegant-Design-High-Torque-Driven-Massager-p-21940454.html?src_identifier=fc%3DAppliances%60sc%3DAppliances%60tc%3D0%60oc%3D0%60ps%3Dtab22navbar22%60jc%3DitemPicking_017172977&src_module=topcat&src_tab_page_id=page_select_class1718930176672&mallCode=1&pageListType=2;1;in Give Gifts;0;2.03;22
1pc Portable Hanging Neck Fan;https://us.shein.com/1pc-Portable-Hanging-Neck-Fan-p-16414241.html?src_identifier=fc%3DAppliances%60sc%3DAppliances%60tc%3D0%60oc%3D0%60ps%3Dtab22navbar22%60jc%3DitemPicking_017172977&src_module=topcat&src_tab_page_id=page_select_class1718930176672&mallCode=1&pageListType=2;4;in Top rated in Portable Fans;0;6.48;20
1pc Pink Colored Curved Eyelash Curler False Eyelash Auxiliary Makeup Tool For Women, Portable;https://us.shein.com/1pc-Pink-Colored-Curved-Eyelash-Curler-False-Eyelash-Auxiliary-Makeup-Tool-For-Women-Portable-p-27577034.html?src_identifier=fc%3DAppliances%60sc%3DAppliances%60tc%3D0%60oc%3D0%60ps%3Dtab22navbar22%60jc%3DitemPicking_017172977&src_module=topcat&src_tab_page_id=page_select_class1718930176672&mallCode=1&pageListType=2;Not Ranked;Not Included;"400+ ";1.80;0
1 Mini Portable Handheld Fan With 2 Aa Batteries (Batteries Not Included), Comes With A Lanyard;https://us.shein.com/1-Mini-Portable-Handheld-Fan-With-2-Aa-Batteries-Batteries-Not-Included-Comes-With-A-Lanyard-p-29977701.html?src_identifier=fc%3DAppliances%60sc%3DAppliances%60tc%3D0%60oc%3D0%60ps%3Dtab22navbar22%60jc%3DitemPicking_017172977&src_module=topcat&src_tab_page_id=page_select_class1718930176672&mallCode=1&pageListType=2;Not Ranked;Not Included;"5.600+ ";0.88;72
Wit Water Flosser,Portable Oral Irrigator With 3 Modes, Nasal Washer, 4 Replaceable Nozzles, Rechargeable Waterproof Tooth Cleaner, For Home And Travel, Removable Large Water Tank;https://us.shein.com/Wit-Water-Flosser-Portable-Oral-Irrigator-With-3-Modes-Nasal-Washer-4-Replaceable-Nozzles-Rechargeable-Waterproof-Tooth-Cleaner-For-Home-And-Travel-Removable-Large-Water-Tank-p-35891349.html?src_identifier=fc%3DAppliances%60sc%3DAppliances%60tc%3D0%60oc%3D0%60ps%3Dtab22navbar22%60jc%3DitemPicking_017172977&src_module=topcat&src_tab_page_id=page_select_class1718930176672&mallCode=1&pageListType=2;6;in Oral Irrigators;0;12.06;40
1pc Ice Pop Mold, Plastic Ice Cream Mold, Frozen Ice Pop Box, Safe Jelly Mould, Kitchen Utensils, Kitchen Accessories;https://us.shein.com/1pc-Ice-Pop-Mold-Plastic-Ice-Cream-Mold-Frozen-Ice-Pop-Box-Safe-Jelly-Mould-Kitchen-Utensils-Kitchen-Accessories-p-36156215.html?src_identifier=fc%3DAppliances%60sc%3DAppliances%60tc%3D0%60oc%3D0%60ps%3Dtab22navbar22%60jc%3DitemPicking_017172977&src_module=topcat&src_tab_page_id=page_select_class1718930176672&mallCode=1&pageListType=2;10;in Refrigerators & Freezers;0;2.70;0
Mini Pocket Bluetooth Thermal Printer, Portable Wireless Inkless Printing Machine For Pictures, Notes, Photos, Journals, DIY, Compatible With IOS And Android Phones;https://us.shein.com/Mini-Pocket-Bluetooth-Thermal-Printer-Portable-Wireless-Inkless-Printing-Machine-For-Pictures-Notes-Photos-Journals-DIY-Compatible-With-IOS-And-Android-Phones-p-34258470.html?src_identifier=fc%3DAppliances%60sc%3DAppliances%60tc%3D0%60oc%3D0%60ps%3Dtab22navbar22%60jc%3DitemPicking_017172977&src_module=topcat&src_tab_page_id=page_select_class1718930176672&mallCode=1&pageListType=2;8;in Other Household Appliances;0;3.50;0
1pc 250ml Humidifier, Cute Cartoon Cat Design Mini Desktop Atomizer Hydrating Device For Bedroom;No URL;Not Ranked;Not Included;"600+ ";2.68;29
1PC/2PCS Quick-Dry Coffee Mat - Large Absorbent Draining Pad For Dishes, Bathroom, And Kitchen;No URL;9;in Kitchen Appliance Parts;0;1.70;60
1 PC 400ML Classic Ultra-Silent Air Humidifier With Dazzling Coloured Lights,Desktop/Car Humidification;https://us.shein.com/1-PC-400ML-Classic-Ultra-Silent-Air-Humidifier-With-Dazzling-Coloured-Lights-Desktop-Car-Humidification-p-35515287.html?src_identifier=fc%3DAppliances%60sc%3DAppliances%60tc%3D0%60oc%3D0%60ps%3Dtab22navbar22%60jc%3DitemPicking_017172977&src_module=topcat&src_tab_page_id=page_select_class1718930176672&mallCode=1&pageListType=2;Not Ranked;Not Included;0;4.90;0
6 Modes Multi-Functional Sonic Electric Toothbrush, 8/4 Heads Kit, Equipped With 2 Minutes Smart Timer And 30S Area Switch Reminder, Waterproof Usb Rechargeable Oral Cleaner Set For Family Or Travel Use;https://us.shein.com/6-Modes-Multi-Functional-Sonic-Electric-Toothbrush-8-4-Heads-Kit-Equipped-With-2-Minutes-Smart-Timer-And-30S-Area-Switch-Reminder-Waterproof-Usb-Rechargeable-Oral-Cleaner-Set-For-Family-Or-Travel-Use-p-21788261.html?src_identifier=fc%3DAppliances%60sc%3DAppliances%60tc%3D0%60oc%3D0%60ps%3Dtab22navbar22%60jc%3DitemPicking_017172977&src_module=topcat&src_tab_page_id=page_select_class1718930176672&mallCode=1&pageListType=2;6;in Oral Care Appliances;0;4.28;41
1pc AA Battery Operated Portable Handheld Mini Fan With Strap, Simple Design, 1-Speed For Outdoor Use;https://us.shein.com/1pc-AA-Battery-Operated-Portable-Handheld-Mini-Fan-With-Strap-Simple-Design-1-Speed-For-Outdoor-Use-p-11243151.html?src_identifier=fc%3DAppliances%60sc%3DAppliances%60tc%3D0%60oc%3D0%60ps%3Dtab22navbar22%60jc%3DitemPicking_017172977&src_module=topcat&src_tab_page_id=page_select_class1718930176672&mallCode=1&pageListType=2;9;in Household Appliances;0;2.76;5
Teckwe Epilator,2*AAA Batteries Portability Removal Device,Cordless Epilators Hair Removal For Women,Hair Removal Cordless Electric Trimmer For Legs Arms Armpit Bikini,Product Does Not Include Batteries;https://us.shein.com/Teckwe-Epilator-2-AAA-Batteries-Portability-Removal-Device-Cordless-Epilators-Hair-Removal-For-Women-Hair-Removal-Cordless-Electric-Trimmer-For-Legs-Arms-Armpit-Bikini-Product-Does-Not-Include-Batteries-p-28126805.html?src_identifier=fc%3DAppliances%60sc%3DAppliances%60tc%3D0%60oc%3D0%60ps%3Dtab22navbar22%60jc%3DitemPicking_017172977&src_module=topcat&src_tab_page_id=page_select_class1718930176672&mallCode=1&pageListType=2;1;in Women Shave & Hair Removal Appliances;0;4.29;35
1pc Portable Pink Electric Eyelash Curler, USB Rechargeable Eye Makeup Tool - Effortlessly Curl Your Eyelashes;https://us.shein.com/1pc-Portable-Pink-Electric-Eyelash-Curler-USB-Rechargeable-Eye-Makeup-Tool-Effortlessly-Curl-Your-Eyelashes-p-35196252.html?src_identifier=fc%3DAppliances%60sc%3DAppliances%60tc%3D0%60oc%3D0%60ps%3Dtab22navbar22%60jc%3DitemPicking_017172977&src_module=topcat&src_tab_page_id=page_select_class1718930176672&mallCode=1&pageListType=2;Not Ranked;Not Included;"50+ ";2.50;0
Reusable Magic Hair Eraser, Painless Exfoliator Removal For Back, Arms, Legs, Portable Epilator Device For Women And Men, Washable Body Hair Trimmer, Efficient Bikini Line Shaver;https://us.shein.com/Reusable-Magic-Hair-Eraser-Painless-Exfoliator-Removal-For-Back-Arms-Legs-Portable-Epilator-Device-For-Women-And-Men-Washable-Body-Hair-Trimmer-Efficient-Bikini-Line-Shaver-p-36157332.html?src_identifier=fc%3DAppliances%60sc%3DAppliances%60tc%3D0%60oc%3D0%60ps%3Dtab22navbar22%60jc%3DitemPicking_017172977&src_module=topcat&src_tab_page_id=page_select_class1718930176672&mallCode=1&pageListType=2;Not Ranked;Not Included;"30+ ";2.70;0
1pc Kitchen Mechanical Timer Egg Shaped Reminder For Baking & Cooking;No URL;Not Ranked;Not Included;0;4.02;18
CHEFTRONIC Stand Mixer, , 3.8 Qt Tilt-Head Electric Household Stand Mixer - 300W 6+P Speed, Multifunctional Kitchen Stand Up Mixer With Dough Hook, Whisk, Food Beater And Butter Beater;No URL;Not Ranked;Not Included;"70+ ";69.26;5
1pc Portable Mini Electrostatic Dry Cleaning Brush Clothes Dust Remover Hair Lint Sticky Roller For Clothes And Sofa;No URL;7;in Personal Care Appliance Accessories;0;3.90;0
Vacuum Sealer For 110V-220V, Food Protector Vacuum Sealer Machine, Automatic Food Vacuum Sealer For Food Preservation Sealing Packing System, For Fresh Food And Food Storage Lightning Deals;https://us.shein.com/Vacuum-Sealer-For-110V-220V-Food-Protector-Vacuum-Sealer-Machine-Automatic-Food-Vacuum-Sealer-For-Food-Preservation-Sealing-Packing-System-For-Fresh-Food-And-Food-Storage-Lightning-Deals-p-33527826.html?src_identifier=fc%3DAppliances%60sc%3DAppliances%60tc%3D0%60oc%3D0%60ps%3Dtab22navbar22%60jc%3DitemPicking_017172977&src_module=topcat&src_tab_page_id=page_select_class1718930176672&mallCode=1&pageListType=2;6;in Vacuum Food Sealers;0;4.80;0
3pcs/Set Laundry Drying Balls, 6cm Reusable Household Washing Machine Balls, Laundry Appliance Accessories;https://us.shein.com/3pcs-Set-Laundry-Drying-Balls-6cm-Reusable-Household-Washing-Machine-Balls-Laundry-Appliance-Accessories-p-33772405.html?src_identifier=fc%3DAppliances%60sc%3DAppliances%60tc%3D0%60oc%3D0%60ps%3Dtab22navbar22%60jc%3DitemPicking_017172977&src_module=topcat&src_tab_page_id=page_select_class1718930176672&mallCode=1&pageListType=2;Not Ranked;Not Included;"60+ ";1.49;55
1pc 900ml Manual Food Processor Garlic Vegetable Chopper, Suitable For Chopping Garlic, Ginger, Chili, Onion And Other Foods;https://us.shein.com/1pc-900ml-Manual-Food-Processor-Garlic-Vegetable-Chopper-Suitable-For-Chopping-Garlic-Ginger-Chili-Onion-And-Other-Foods-p-27977030.html?src_identifier=fc%3DAppliances%60sc%3DAppliances%60tc%3D0%60oc%3D0%60ps%3Dtab22navbar22%60jc%3DitemPicking_017172977&src_module=topcat&src_tab_page_id=page_select_class1718930176672&mallCode=1&pageListType=2;8;in Juicer & Food Processor;0;3.07;63
1pc White Half-Wrap Fan Dustproof Cover For Home Use, Waterproof, Moisture-Proof, Dustproof Fan Protective Cover, Easy To Put On And Take Off, Washable And Reusable, Keeping The Fan Clean;https://us.shein.com/1pc-White-Half-Wrap-Fan-Dustproof-Cover-For-Home-Use-Waterproof-Moisture-Proof-Dustproof-Fan-Protective-Cover-Easy-To-Put-On-And-Take-Off-Washable-And-Reusable-Keeping-The-Fan-Clean-p-33416096.html?src_identifier=fc%3DAppliances%60sc%3DAppliances%60tc%3D0%60oc%3D0%60ps%3Dtab22navbar22%60jc%3DitemPicking_017172977&src_module=topcat&src_tab_page_id=page_select_class1718930176672&mallCode=1&pageListType=2;5;in Cleaning Appliance Parts;0;1.86;28
Ear Wax Removal Tool Camera,Ear Cleaner With Camera,Ear Wax Cleaner With Camera,7 Ear Pick,10pcs Bebird Replacement Tips,1080p Ear Camera,6 Led Lights,Earwax Removal Kit For Daily Ear Canal Cleaning;https://us.shein.com/Ear-Wax-Removal-Tool-Camera-Ear-Cleaner-With-Camera-Ear-Wax-Cleaner-With-Camera-7-Ear-Pick-10pcs-Bebird-Replacement-Tips-1080p-Ear-Camera-6-Led-Lights-Earwax-Removal-Kit-For-Daily-Ear-Canal-Cleaning-p-33253724.html?src_identifier=fc%3DAppliances%60sc%3DAppliances%60tc%3D0%60oc%3D0%60ps%3Dtab22navbar22%60jc%3DitemPicking_017172977&src_module=topcat&src_tab_page_id=page_select_class1718930176672&mallCode=1&pageListType=2;Not Ranked;Not Included;0;24.10;0
1pc Blue Lint Remover, Wool Sweater Shaver, Clothes Fuzz Ball Trimmer For Home Use;https://us.shein.com/1pc-Blue-Lint-Remover-Wool-Sweater-Shaver-Clothes-Fuzz-Ball-Trimmer-For-Home-Use-p-23831823.html?src_identifier=fc%3DAppliances%60sc%3DAppliances%60tc%3D0%60oc%3D0%60ps%3Dtab22navbar22%60jc%3DitemPicking_017172977&src_module=topcat&src_tab_page_id=page_select_class1718930176672&mallCode=1&pageListType=2;9;in Laundry Appliances;0;0.75;53
1pc Four Layer Slide Egg Storage Box, Refrigerator Side Door Storage Box, Rolling Egg  Egg Rack Holder, Automatic Rolling Egg Box;https://us.shein.com/1pc-Four-Layer-Slide-Egg-Storage-Box-Refrigerator-Side-Door-Storage-Box-Rolling-Egg-Egg-Rack-Holder-Automatic-Rolling-Egg-Box-p-35264869.html?src_identifier=fc%3DAppliances%60sc%3DAppliances%60tc%3D0%60oc%3D0%60ps%3Dtab22navbar22%60jc%3DitemPicking_017172977&src_module=topcat&src_tab_page_id=page_select_class1718930176672&mallCode=1&pageListType=2;Not Ranked;Not Included;"30+ ";14.60;0
New 2 In 1 Mini Irons, Mini Travel Iron, Portable Ironing Clothes Foldable Rotating Handheld Irons, Travel Mini Irons Wrinkle Remover Ironing Machine;https://us.shein.com/New-2-In-1-Mini-Irons-Mini-Travel-Iron-Portable-Ironing-Clothes-Foldable-Rotating-Handheld-Irons-Travel-Mini-Irons-Wrinkle-Remover-Ironing-Machine-p-33809318.html?src_identifier=fc%3DAppliances%60sc%3DAppliances%60tc%3D0%60oc%3D0%60ps%3Dtab22navbar22%60jc%3DitemPicking_017172977&src_module=topcat&src_tab_page_id=page_select_class1718930176672&mallCode=1&pageListType=2;2;in Laundry Appliances;0;11.25;11
Mini Portable USB Charging Sealing Machine For Snack Plastic Bags - Easy Manual Sealing Clip With Fast Charging Benefits;https://us.shein.com/Mini-Portable-USB-Charging-Sealing-Machine-For-Snack-Plastic-Bags-Easy-Manual-Sealing-Clip-With-Fast-Charging-Benefits-p-31598820.html?src_identifier=fc%3DAppliances%60sc%3DAppliances%60tc%3D0%60oc%3D0%60ps%3Dtab22navbar22%60jc%3DitemPicking_017172977&src_module=topcat&src_tab_page_id=page_select_class1718930176672&mallCode=1&pageListType=2;Not Ranked;Not Included;"100+ ";2.15;50
1pc Plain Egg Separator;https://us.shein.com/1pc-Plain-Egg-Separator-p-16704675.html?src_identifier=fc%3DAppliances%60sc%3DAppliances%60tc%3D0%60oc%3D0%60ps%3Dtab22navbar22%60jc%3DitemPicking_017172977&src_module=topcat&src_tab_page_id=page_select_class1718930176672&mallCode=1&pageListType=2;Not Ranked;Not Included;"100+ ";0.74;47
6 Blades USB Portable Juicer Maker, Juicer Fruit Juice Cup Automatic Small Electric Juicer Smoothie Blender Ice CrushCup Food Processor;https://us.shein.com/6-Blades-USB-Portable-Juicer-Maker-Juicer-Fruit-Juice-Cup-Automatic-Small-Electric-Juicer-Smoothie-Blender-Ice-CrushCup-Food-Processor-p-32346773.html?src_identifier=fc%3DAppliances%60sc%3DAppliances%60tc%3D0%60oc%3D0%60ps%3Dtab22navbar22%60jc%3DitemPicking_017172977&src_module=topcat&src_tab_page_id=page_select_class1718930176672&mallCode=1&pageListType=2;6;in Fruit & Vegetable Tools;0;8.94;28
1PC 16LED USB/Battery Dual Use Makeup Mirror Light, Desktop Mirror Surface Rotatable Makeup Mirror Light 3-Speed Touch Screen Vanity Mirror, Brightness Adjustable Cosmetic Light Up Mirror, Portable Dormitory Bedroom Desktop Vanity Mirror With Light;https://us.shein.com/1PC-16LED-USB-Battery-Dual-Use-Makeup-Mirror-Light-Desktop-Mirror-Surface-Rotatable-Makeup-Mirror-Light-3-Speed-Touch-Screen-Vanity-Mirror-Brightness-Adjustable-Cosmetic-Light-Up-Mirror-Portable-Dormitory-Bedroom-Desktop-Vanity-Mirror-With-Light-p-25998344.html?src_identifier=fc%3DAppliances%60sc%3DAppliances%60tc%3D0%60oc%3D0%60ps%3Dtab22navbar22%60jc%3DitemPicking_017172977&src_module=topcat&src_tab_page_id=page_select_class1718930176672&mallCode=1&pageListType=2;Not Ranked;Not Included;"200+ ";8.55;29
1pc Silicone Ice Cube Trays With Lids, 2 Inches Rose Ice Cube Trays With Covers, 6 Cavity Silicone Rose Ice Ball Maker, Easy Release Large Ice Cube Form For Chilled Cocktails, Whiskey, Bourbon & Homemade Juice;https://us.shein.com/1pc-Silicone-Ice-Cube-Trays-With-Lids-2-Inches-Rose-Ice-Cube-Trays-With-Covers-6-Cavity-Silicone-Rose-Ice-Ball-Maker-Easy-Release-Large-Ice-Cube-Form-For-Chilled-Cocktails-Whiskey-Bourbon-Homemade-Juice-p-36158834.html?src_identifier=fc%3DAppliances%60sc%3DAppliances%60tc%3D0%60oc%3D0%60ps%3Dtab22navbar22%60jc%3DitemPicking_017172977&src_module=topcat&src_tab_page_id=page_select_class1718930176672&mallCode=1&pageListType=2;Not Ranked;Not Included;0;4.70;13
1PC Glass Honey Jar,  Honey Container With Wooden Scoop And Lid, Honey Jar With Wooden Plunger For Home Kitchen Storage Of Honey Syrup Hive Honey;No URL;Not Ranked;Not Included;0;4.45;50
1pc Small Portable Car Vacuum Cleaner With Strong Suction, Multipurpose And Convenient For Multiple Scenarios;No URL;8;in Car Vacuum Cleaner;0;5.96;37
Heart-Shaped Scraping Board, Imitation Jade/Pink Crystal/Plastic Crystal Scraping Board;No URL;Not Ranked;Not Included;"40+ ";0.87;49
1pc Pink 500ml Manual Garlic Masher For Home Use, Hand-held Garlic Press For Cutting Vegetables, Suitable For Chopping Garlic, Ginger, Chili, Onion And Other Foods;https://us.shein.com/1pc-Pink-500ml-Manual-Garlic-Masher-For-Home-Use-Hand-held-Garlic-Press-For-Cutting-Vegetables-Suitable-For-Chopping-Garlic-Ginger-Chili-Onion-And-Other-Foods-p-25154681.html?src_identifier=fc%3DAppliances%60sc%3DAppliances%60tc%3D0%60oc%3D0%60ps%3Dtab22navbar22%60jc%3DitemPicking_017172977&src_module=topcat&src_tab_page_id=page_select_class1718930176672&mallCode=1&pageListType=2;7;in Blenders;0;3.46;48
1pc Wax Bean Heater Hair Removal Tool For Both Women & Men, Large Capacity;https://us.shein.com/1pc-Wax-Bean-Heater-Hair-Removal-Tool-For-Both-Women-Men-Large-Capacity-p-21530539.html?src_identifier=fc%3DAppliances%60sc%3DAppliances%60tc%3D0%60oc%3D0%60ps%3Dtab22navbar22%60jc%3DitemPicking_017172977&src_module=topcat&src_tab_page_id=page_select_class1718930176672&mallCode=1&pageListType=2;Not Ranked;Not Included;"100+ ";12.50;0
1PC Epilator Face Hair Removal Lipstick Shaver Electric Eyebrow Trimmer Women's Painless Hair Remover Mini Shaver Epilator For Women [Dry Cell Type (Excluding Battery)];https://us.shein.com/1PC-Epilator-Face-Hair-Removal-Lipstick-Shaver-Electric-Eyebrow-Trimmer-Women-s-Painless-Hair-Remover-Mini-Shaver-Epilator-For-Women-Dry-Cell-Type-Excluding-Battery-p-18607363.html?src_identifier=fc%3DAppliances%60sc%3DAppliances%60tc%3D0%60oc%3D0%60ps%3Dtab22navbar22%60jc%3DitemPicking_017172977&src_module=topcat&src_tab_page_id=page_select_class1718930176672&mallCode=1&pageListType=2;Not Ranked;Not Included;"8.700+ ";2.60;4
1pc + Rechargeable + 500mah Lithium Battery + Handheld Portable + Standable + With Hanging Rope + 3-Level Adjustable;https://us.shein.com/1pc-Rechargeable-500mah-Lithium-Battery-Handheld-Portable-Standable-With-Hanging-Rope-3-Level-Adjustable-p-30318916.html?src_identifier=fc%3DAppliances%60sc%3DAppliances%60tc%3D0%60oc%3D0%60ps%3Dtab22navbar22%60jc%3DitemPicking_017172977&src_module=topcat&src_tab_page_id=page_select_class1718930176672&mallCode=1&pageListType=2;Not Ranked;Not Included;"200+ ";4.20;22
Electric Garlic Masher, Portable Mini Garlic Chopper, Garlic Blender, Household Electric Garlic Press, Wireless Garlic Mincer, Garlic Slicer, Portable Compact Design, Easy-To-Use Kitchen Tool,Kitchen,Kitchen Items,Food,Cooking,Camping,Meat,Poultry,Room Decor,Organizer,Party.;https://us.shein.com/Electric-Garlic-Masher-Portable-Mini-Garlic-Chopper-Garlic-Blender-Household-Electric-Garlic-Press-Wireless-Garlic-Mincer-Garlic-Slicer-Portable-Compact-Design-Easy-To-Use-Kitchen-Tool-Kitchen-Kitchen-Items-Food-Cooking-Camping-Meat-Poultry-Room-Decor-Organizer-Party-p-36134210.html?src_identifier=fc%3DAppliances%60sc%3DAppliances%60tc%3D0%60oc%3D0%60ps%3Dtab22navbar22%60jc%3DitemPicking_017172977&src_module=topcat&src_tab_page_id=page_select_class1718930176672&mallCode=1&pageListType=2;8;in Kitchen Meat Grinders;0;9.30;0
1pc 4-Grid Egg Frying Pan, Kitchen Baking Mold, Flower Shaped Silicone Egg Cooking Mold;https://us.shein.com/1pc-4-Grid-Egg-Frying-Pan-Kitchen-Baking-Mold-Flower-Shaped-Silicone-Egg-Cooking-Mold-p-13071942.html?src_identifier=fc%3DAppliances%60sc%3DAppliances%60tc%3D0%60oc%3D0%60ps%3Dtab22navbar22%60jc%3DitemPicking_017172977&src_module=topcat&src_tab_page_id=page_select_class1718930176672&mallCode=1&pageListType=2;6;in Egg Cookers;0;2.10;0
Portable Mini Battery Powered Car & Desktop & Keyboard Vacuum Cleaner For Home Office Cleaning;No URL;3;in Cleaning Appliances;0;2.70;52
Hair Clipper, Men's Trimmer, Abs Body, Golden Color, Dragon Pattern, Mens Grooming Kit;No URL;3;in Electric Hair Clippers;0;2.80;3
1pc Stainless Steel  Mini Electric Coffee Blender Handheld Eggbeater Bubble Drink Stir Bar Household Kitchen;No URL;Not Ranked;Not Included;"1.800+ ";1.74;21
2-In-1 Watermelon Fork Slicer Cutter, 2024 Summer New Watermelon Slicer Cutter, Watermelon Fork Slicer, Summer Watermelon Cutting Artifact, Stainless Steel Fruit Forks Slicer Knife. Dual Head Stainless Steel Fruit Forks Slicer Knife For Family Parties Camping Party, Kitchen Gadgets, Kitchen Supplies;https://us.shein.com/2-In-1-Watermelon-Fork-Slicer-Cutter-2024-Summer-New-Watermelon-Slicer-Cutter-Watermelon-Fork-Slicer-Summer-Watermelon-Cutting-Artifact-Stainless-Steel-Fruit-Forks-Slicer-Knife-Dual-Head-Stainless-Steel-Fruit-Forks-Slicer-Knife-For-Family-Parties-Camping-Party-Kitchen-Gadgets-Kitchen-Supplies-p-35401199.html?src_identifier=fc%3DAppliances%60sc%3DAppliances%60tc%3D0%60oc%3D0%60ps%3Dtab22navbar22%60jc%3DitemPicking_017172977&src_module=topcat&src_tab_page_id=page_select_class1718930176672&mallCode=1&pageListType=2;Not Ranked;Not Included;"100+ ";1.90;0
O3 Ozone Generator Air Purifier,Refrigerator Deodorizer,Food Shelf Life Extender,Remove Smoke Pet Toilet Smell;https://us.shein.com/O3-Ozone-Generator-Air-Purifier-Refrigerator-Deodorizer-Food-Shelf-Life-Extender-Remove-Smoke-Pet-Toilet-Smell-p-30029863.html?src_identifier=fc%3DAppliances%60sc%3DAppliances%60tc%3D0%60oc%3D0%60ps%3Dtab22navbar22%60jc%3DitemPicking_017172977&src_module=topcat&src_tab_page_id=page_select_class1718930176672&mallCode=1&pageListType=2;10;in Air Purifiers;0;6.12;40
1pc 4D Multifunctional Lifting And Tightening Massage Instrument For Home Use - One Tool For Total Body Beauty And Skin Care;https://us.shein.com/1pc-4D-Multifunctional-Lifting-And-Tightening-Massage-Instrument-For-Home-Use-One-Tool-For-Total-Body-Beauty-And-Skin-Care-p-27482222.html?src_identifier=fc%3DAppliances%60sc%3DAppliances%60tc%3D0%60oc%3D0%60ps%3Dtab22navbar22%60jc%3DitemPicking_017172977&src_module=topcat&src_tab_page_id=page_select_class1718930176672&mallCode=1&pageListType=2;Not Ranked;Not Included;"100+ ";4.66;20
5 In 1 Multi-Function Electric Scrubber  Portable Spin Scrubber, Cordless Handheld Cleaning Brush For Bathroom/Tub/Wall Tiles/ Floor/Kitchen Usb Rechargeable Kitchen Dish Washing Brush Sink Cleaner Bathroom Bathtub Clean Brush Spin Scrubber Electric Cleaning Brush;https://us.shein.com/5-In-1-Multi-Function-Electric-Scrubber-Portable-Spin-Scrubber-Cordless-Handheld-Cleaning-Brush-For-Bathroom-Tub-Wall-Tiles-Floor-Kitchen-Usb-Rechargeable-Kitchen-Dish-Washing-Brush-Sink-Cleaner-Bathroom-Bathtub-Clean-Brush-Spin-Scrubber-Electric-Cleaning-Brush-p-33421284.html?src_identifier=fc%3DAppliances%60sc%3DAppliances%60tc%3D0%60oc%3D0%60ps%3Dtab22navbar22%60jc%3DitemPicking_017172977&src_module=topcat&src_tab_page_id=page_select_class1718930176672&mallCode=1&pageListType=2;Not Ranked;Not Included;"10+ ";5.96;47
1pc 10ml Oil-Based Aroma Refill, Suitable For Aromatherapy Candles, Fragrance Stones, Aromatherapy Plaster, Not For Humidifiers;https://us.shein.com/1pc-10ml-Oil-Based-Aroma-Refill-Suitable-For-Aromatherapy-Candles-Fragrance-Stones-Aromatherapy-Plaster-Not-For-Humidifiers-p-28352242.html?src_identifier=fc%3DAppliances%60sc%3DAppliances%60tc%3D0%60oc%3D0%60ps%3Dtab22navbar22%60jc%3DitemPicking_017172977&src_module=topcat&src_tab_page_id=page_select_class1718930176672&mallCode=1&pageListType=2;Not Ranked;Not Included;"1.600+ ";1.60;0
Electric Hair Straightener Brush Straightening Curler Hot Comb LCD Display Flat Iron;https://us.shein.com/Electric-Hair-Straightener-Brush-Straightening-Curler-Hot-Comb-LCD-Display-Flat-Iron-p-19897495.html?src_identifier=fc%3DAppliances%60sc%3DAppliances%60tc%3D0%60oc%3D0%60ps%3Dtab22navbar22%60jc%3DitemPicking_017172977&src_module=topcat&src_tab_page_id=page_select_class1718930176672&mallCode=1&pageListType=2;Not Ranked;Not Included;0;23.50;0
1PC Epilator Face Hair Lipstick Shaver Electric Eyebrow Trimmer Women's Painless Hair Removal Remover Mini Shaver Epilator For Women;No URL;Not Ranked;Not Included;"100+ ";1.30;50
1pc Silicone Ice Cube Trays With Lids;https://us.shein.com/1pc-Silicone-Ice-Cube-Trays-With-Lids-p-25454957.html?src_identifier=fc%3DAppliances%60sc%3DAppliances%60tc%3D0%60oc%3D0%60ps%3Dtab22navbar22%60jc%3DitemPicking_017172977&src_module=topcat&src_tab_page_id=page_select_class1718930176672&mallCode=1&pageListType=2;Not Ranked;Not Included;"30+ ";3.90;29
1pc Kitchen Long-Handled Noodle & Soup Strainer Ladle With Drainer;https://us.shein.com/1pc-Kitchen-Long-Handled-Noodle-Soup-Strainer-Ladle-With-Drainer-p-35622960.html?src_identifier=fc%3DAppliances%60sc%3DAppliances%60tc%3D0%60oc%3D0%60ps%3Dtab22navbar22%60jc%3DitemPicking_017172977&src_module=topcat&src_tab_page_id=page_select_class1718930176672&mallCode=1&pageListType=2;Not Ranked;Not Included;0;1.70;0
4pcs Makeup Sponge Beauty Egg Set - Makeup Sponge For Foundation Blending With Egg Holder, Perfectly Used For Cream, Powder, Blush, Concealer, And Liquid;No URL;10;in Other Body Care Machines;0;2.70;0
1pc Salon Tools Black Pink Universal Silicone Hair Dryer Diffuser Hood Adjustable Temperature Dispersion Resistant Drying Hair Dryer;No URL;1;in Hair Dryers;0;4.38;32
Portable Lithium Battery Powered Hair Trimmer & Nose Hair Trimmer;No URL;2;in Electric Nose & Ear Trimmers;0;2.86;25
Multifunctional Manual Food Chopper, Kitchen Vegetable Fruit Onion Garlic Nuts Herb Slicer, Hand-Powered Mixing Cutter, Green;No URL;7;in Juicer & Food Processor;0;3.46;51
1 Set Of 2 Portable Fan Cleaning Brushes, Household Multi-Purpose Keyboard And Gap Cleaning Small Brush - Deep Into The Gap, Easily Remove Dust.;No URL;7;in Cleaning Appliance Parts;0;2.40;0
Smart Electric Toothbrush With 6 Modes 42000vpm & Smart Timer - Effectively Cleans Teeth & Gums, Rechargeable USB Electric Toothbrush With 4/8 Replacement Head, Electric Toothbrush For Adults, Available In 3 Colors, Great Gift Father's Day Gift;No URL;8;in Electric Toothbrushes;0;2.60;0
1pc 12.7cm Aluminum Metal Electric Battery Type Eyebrow Shaver Nose Hair Trimmer;No URL;5;in Electric Nose & Ear Trimmers;0;2.10;46
Professional Curler, Electrically Heated Automatic Curler, Negative Ion Electric Clip Curler, Portable Heated Hair Styling Tool For Home Use, Salon, Hair Salon, Mother's Day Gift;No URL;Not Ranked;Not Included;0;35.00;0
