1pc Egg Poacher  Microwave Egg Steamer  Round Shape Plastic Egg Omelette Tools  Kitchen Supplies  DIY Egg Tool Baking Tool;No URL;Not Ranked;Not Included;"100+ ";2.40;0
1pc ABS Portable Electric Eyebrow Trimmer;No URL;1;in Electric Eyebrow Trimmer;0;2.90;0
Soft Silicone Massage Shampoo Brush, 1pc Multicolor Manual Head Massager Bath Use Scalp Massager, Hair Brush/Hair Comb Black Friday;No URL;Not Ranked;Not Included;"90+ ";1.60;0
Teckwe Hot Comb Straightener,Multi-Functional Hair Styling Tool For Family Daily Use,Quick And Easy,Copper Hair Straightening Comb For American African Hair,Ceramic Electric Hot Comb For Women Hair - US Plug;No URL;4;in Hair Styling Care Appliances;0;9.12;35
Home Personal Care Electronic LCD Digital Arm Blood Pressure Monitor, Electronic Blood Pressure Monitor, Large Screen Arm English Blood Pressure Measurement, Essential For Home Testing(Product Does Not Contain Batteries);No URL;Not Ranked;Not Included;0;9.30;19
Rechargeble Handheld Wireless Vacuum Cleaner, 1200mAH Battery, USB Charging, Reusable Filter Cartridge, For Car Cleaning;No URL;2;in Cleaning Appliances;0;8.50;0
1pc Portable Neck Fan, Hands Free Bladeless Fan, Leafless, Rechargeable, Headphone Design, USB Powered Desk Fan,3 Speeds;No URL;Not Ranked;Not Included;"50+ ";8.63;25
1pc Geometric Shaped Silicone Egg Ring;No URL;Not Ranked;Not Included;"300+ ";2.70;0
1pc White Multifunctional Electric Cleaning Brush, Portable Wireless Powerful Cleaning Brush, Replaceable Brush Head Handheld Electric Cleaning Brush, Suitable For Kitchen, Bathroom;No URL;1;in Electric Cleaning Brushes;0;8.80;0
1pc Stainless Steel  Mini Electric Coffee Blender Handheld Eggbeater Bubble Drink Stir Bar Household Kitchen;No URL;Not Ranked;Not Included;"200+ ";2.10;0
3pcs Household Stainless Steel Milk Frother Mixer Set, Including A Body, A Mixing Head, A Whisk Head And A Stand To Meet Different Needs;No URL;8;in Milk Frothers;0;8.50;0
Chicken Chopper With Handle, Meat Chopper For Shredding Pork, Beef And Chicken, 1pc. Chicken Chopper Tool For Dicing And Shredding Chicken Breast, Chicken Stripper Tool;No URL;Not Ranked;Not Included;"2.200+ ";5.30;0
4 In 1 Facial Electric Shaver For Women, Full Body Epilator Rechargeable Eyebrow Nose Bikini Hair Trimmer;No URL;Not Ranked;Not Included;"100+ ";6.70;4
Mini USB Fan Portable Fans Metal Cooler Cooling 4 Blades Desktop Mute Fans Silent Universal For Car Notebook Computer Desk Fan;No URL;Not Ranked;Not Included;"800+ ";5.70;19
KEmei Shaver KM-8512 Double-Layer Reciprocating Full Body Washing LED LCD Digital Display Electric Shaver;No URL;Not Ranked;Not Included;0;23.20;0
Mini Handheld Fan Battery Operated Small Personal Portable Fan Speed Adjustable USB Rechargeable Fan Cute Design Powerful Eyelash Fan For Home Office Car Outdoor Travel;No URL;Not Ranked;Not Included;0;3.70;0
2-In-1 Hair Straightener And Curler Comb Hair Straightener Curling Iron Hot Tools Curling Iron Heated Styling Iron Brush Gift For Women Travel Home Salon;No URL;4;in Hair Straightening Irons;0;9.50;3
800ml Anti-Gravity Humidifier With Reverse Water Dropping For Office, Home, Bedroom, Silent Large Mist Small Spray Humidifier;No URL;Not Ranked;Not Included;"50+ ";23.10;0
Portable 4-in-1 Women's Electric Shaver For Shaping Eyebrows, Removing Hair From Temple, Underarm And Legs With Usb Charging;No URL;4;in Epilators;0;12.30;0
1PC Portable Wireless Handheld Car Vacuum Cleaner, Mini, For Home And Car Use;No URL;Not Ranked;Not Included;"100+ ";9.40;0
1pc/4pcs/6pcs Portable Hanging Humidity Box Set Combination, Moisture-Proof Bag Moisture-Proof Box Set, Effectively Absorb Excess Moisture, Wardrobe Dehumidification And Deodorization, Suitable For Closets, Wardrobes, Bedrooms;No URL;7;in Dehumidifiers;0;3.90;0
1pc Ice Shaver And Snow Cone Machine, Portable Ice Crusher And Shaved Ice Machine With Free Ice Cube Trays,;No URL;9;in Kitchen Appliances;0;14.80;0
1pc Stainless Steel Kitchen Electronic Scale, 22lb/10kg Electric Digital Food Scale, 1g/0.04oz High Precision Measuring Scale For Weight Loss, Baking, Cooking, Kitchen Scale, Kitchen Gadgets, Kitchen Supplies;No URL;Not Ranked;Not Included;"10+ ";10.90;5
Colorful Mini Humidifier, Compact, USB-Powered For Home, Car And Desktop Use;No URL;Not Ranked;Not Included;"10+ ";2.90;0
A Liushu Toilet Cleaner, Intelligent Toilet Cleaner, Toilet Accessory, Intelligent Induction Toilet Deodorizer For Removing Odor In Bathroom;No URL;Not Ranked;Not Included;0;13.90;0
Handheld Fan, Portabe Fan Battery Powered Fan With LED, Small Personal Usb Folding Skincare Little Wireless Cooling Powerful Quiet Hand Fans, Mini Fan Handheld;No URL;Not Ranked;Not Included;"40+ ";6.90;0
Mini Handheld Fan USB Charging Ultra-Quiet Lightweight And Portable Desk Cooler, Portable Air Conditioner For Home Office Travel Outdoor, Aire Aconditionado;No URL;Not Ranked;Not Included;"6.900+ ";4.60;0
Electric Toothbrush 5 Modes 8 Replacement Brush Heads Wireless Charging Ipx7 Grade Waterproof Includes Travel Casual Box Ideal Gift For Home And Traveling Adults To Protect Oral Health With Teeth Whitening;No URL;Not Ranked;Not Included;"70+ ";23.60;0
1pc Mini Portable Plastic Sealing Machine For Thin Plastic Bags/Packaging, 2xAA Battery Powered Small Sealer (Battery Not Included);No URL;5;in Vacuum Food Sealers;0;5.40;0
3pcs/6pcs/Set New Egglettes Egg Cooker Silicone Steamer Mini Steamer Egg Cup;No URL;Not Ranked;Not Included;"100+ ";3.00;0
1pc LCD Display Measuring Spoon Scale, Adjustable Volume Digital Spoon Scale, Handheld Accessory Scale For Food Measuring, Suitable For Coffee And Milk Tea (Without Battery);No URL;5;in Digital Kitchen Scales;0;1.61;62
1pc Usb Rechargeable Portable Neck Fan With 5 Modes, Digital Display, Led Lighting And Battery Indicator. Suitable For Home/Travel/Camping/Office/Exercise/Work/Night Running. Hands-Free, Keeping Cool And Comfortable;No URL;Not Ranked;Not Included;"400+ ";13.10;0
Mini Handheld Fan, 3 Speed USB Desk Fan, Lightweight Makeup USB Fan Small Personal Portable Table Fan With USB Rechargeable Battery Operated Cooling Folding Electric Fan For Travel Office Room Household;No URL;Not Ranked;Not Included;"100+ ";4.40;0
1pc LED Nail Lamp, Nail Dryer Gel Nail Polish Curing LED UV Light, With 4 Timers Automatic Sensor LCD Display Professional Nail Art Tool, Accessories For Fingernail Toenail Salon;No URL;7;in Electronic Nail Art Equipment;0;10.40;0
1pc Battery Operated Portable Outdoor Party Bar Gift Wine Opener;No URL;Not Ranked;Not Included;0;19.20;0
1pc 2*AA Batteries Powerful Electric Milk Frother Handheld Foam Maker For Lattes - Whisk Drink Mixer For Coffee, Mini Foamer For Cappuccino, Frappe, Matcha, Hot Chocolate;No URL;Not Ranked;Not Included;"600+ ";2.24;20
360° High-Velocity Dual-Head USB Fan - Portable, Quiet Cooling With Touch Control, Perfect For Home & Car;No URL;Not Ranked;Not Included;"200+ ";14.30;0
1pc Rechargeable Mini Portable Sealer With Opening Function, 2-in-1 Sealer For Thin Plastic Bags And Packets;No URL;Not Ranked;Not Included;"70+ ";6.00;0
1pc Car Seat Cooling Fan, USB Interface Electric Car Fan, Multi-Functional Rear Seat Rear Fan, Strong Wind, Small And Portable Fan;No URL;Not Ranked;Not Included;"200+ ";10.80;0
Pink New Desktop/Wall Mounted Usb Electric Fan For Household/Student Dormitory/Bedroom/Office With Mini Portable Size;No URL;Not Ranked;Not Included;"1.000+ ";10.40;0
1 fish scale remover, made of PP, easy to handle, easy to clean, non-slip and durable, suitable for kitchen Blue/Green/Beige;No URL;8;in Specialty Kitchen Appliances;0;1.70;0
100pcs Disposable Air Fryer Liners, Kitchen Accessories, Non-Stick Air Fryer Accessories, Oil-Proof And Waterproof, Suitable For Baking, Grilling And Microwave, Air Fryer Paper;No URL;5;in Air Fryers;0;5.00;0
1pc Plastic Manual Muscle Massage Roller With Round Handle, Massager Cellulite Roller For Leg Arm Back Muscle Pain Relief And Muscle Relaxation;No URL;Not Ranked;Not Included;"100+ ";5.20;0
1pc Household Electric Milk Frother, Cream & Egg Whisk, Mixer;No URL;Not Ranked;Not Included;"50+ ";14.00;0
Kemei KM-2030 Rechargeable Profession Metallic Electric Trimmer Hair Clipper LCD Cordless Hair Trimmer Professional Hair Trimmer;No URL;Not Ranked;Not Included;0;35.10;0
1pc Handheld Spray Fan USB Charging Humidification Spray Hanging Neck Fan Outdoor Folding Mini Handheld Small Fan (4 Colors Optional);No URL;Not Ranked;Not Included;"100+ ";3.45;52
1pc New Mini Eggshell Nail Dryer Led Uv Lamp, Portable Gel Polish Curing Light, Nail Art Tool Set, Usb Powered, Best Gift For Women;No URL;Not Ranked;Not Included;"100+ ";2.60;0
8cm/10cm Humidifier Filter Mini Home Office Aroma Diffuser Replacement Sticks 10pcs/pack;No URL;Not Ranked;Not Included;"400+ ";1.60;0
Mini Electric Lint Remover, Battery-operated Fabric Shaver, Clothes Fuzz Removing Machine;No URL;Not Ranked;Not Included;"200+ ";4.84;22
2/4/6/9Cup Coffee Maker Stainless Steel Espresso Maker 100-470ML Mocha Pot Espresso Maker For Home Kitchen Camping;No URL;Not Ranked;Not Included;"60+ ";10.00;0
1pc Plug-In Mini Iron For Diy Heat Transfer, Lightweight And Portable, Enjoying Handicraft Fun, Making Delicate Iron On Transfer And Decals On Clothes For Children;No URL;6;in Laundry Appliances;0;8.90;0
1pc Professional Electric Hair Clipper T-Blade Beard Trimmer USBCharging Cordless Hair Clipper Set Retro Men's Hair Clipper  SuitableFor Father's Day Gifts;No URL;1;in Styling Tools & Appliances;0;3.40;0
1pc Women's Rechargeable 2-In-1 Facial Shaver And Hair Trimmer With Epilator, Lip And Eyebrow Hair Removal - Get Smooth, Flawless Skin In Minutes!;No URL;Not Ranked;Not Included;"100+ ";4.00;2
Mini Bendable USB Nail Dryer Foldable UV LED Lamp For Nails Gel Polish Drying Glue Nail Drying Lamp Nail Art Manicure Tools;No URL;6;in Beauty & Body Care Appliances;0;2.80;3
Car Wire Vacuum Cleaner USB Charging Car Household Vacuum Cleaner Small Car With Fully Automatic High Power Powerful Cleaning Strong Suction Cleaning Mini Machine Wire Portable Handhled Blower Machine Air Duster For Home Appliances;No URL;Not Ranked;Not Included;"300+ ";12.60;0
"Havato Electric Fireplace 25"" Freestanding Electric Fireplace With Remote Control,Available In Winte,Overheating-Protection,Room Decor,Realistic Flame,Elegant Cathedral Design Electric Fireplace Heater For Indoor Use";No URL;Not Ranked;Not Included;0;152.99;15
Mini Humidifier - Cool Mist Aroma Diffuser For Car, Office, Bedroom - 220mL Capacity - 2 Mist Modes - Quiet Operation Christmas Gift;No URL;Not Ranked;Not Included;"200+ ";2.70;0
1pc Rechargeable Lint Remover, Portable Household Fabric Shaver, Sweater Pill Trimmer, Clothes Fuzz Removing Machine For Home Dorm Use;No URL;9;in Lint Removers;0;10.90;0
1 Three-Speed Adjustable Electric Handheld Milk Frother, Including 2 Mixing Heads And A Body, Silver-White Appearance, USB Rechargeable And Durable;No URL;6;in Milk Frothers;0;8.50;0
UV Nail Dryer Lamp 18 UV LED Light For All Gels  Timer Professional Manicure Pedicure Nail Epuipmen;No URL;8;in Electronic Nail Art Equipment;0;5.20;0
1pc Semi-automatic Rotary Egg Beater, Stainless Steel Egg Whisk, Kitchen Tools,Semi Automatic Whisk & 1pc Separator;No URL;7;in Egg Cookers;0;1.18;61
1pc Colorful 400ml Cool Mist Humidifier - Essential Oil Diffuser For Room, Office, Desktop, Home, Car - Air Fresheners And Back To School Supplies;No URL;Not Ranked;Not Included;"400+ ";5.80;0
1pc Electric Kettle For Boiling Water, Coffee Tea Maker, Stainless Steel Inner Lid And Filter, 63.5 Oz/1000 Watt, Hot Water Boiler, 45° Streamlined Spout Design, Large Opening And Auto-Close, , LED Light;No URL;1;in Electric Kettles;0;27.90;0
1pc Rechargeable Portable Men's Hair Clipper, Black One-piece Buddha Head, Suitable For Home And Professional Barbershop Use;No URL;Not Ranked;Not Included;"200+ ";3.60;0
1pc Electric Garlic Chopper, Portable VeggieChopper , Garlic Press 250ML,100ML, Garlic GrinderMasher Onion Chopper, Blender To Vegetable,Cordless Food Processor For Ginger, Chili, FruitMeat, Spices, Beans,;No URL;Not Ranked;Not Included;"500+ ";8.30;0
Toaster 2 Slice with Extra-Wide Slot for Toasting Bagels, Breads, Waffles & More;No URL;Not Ranked;Not Included;0;39.99;20
1PC Rechargeable 2000mAh Portable Hanging Neck Fan Outdoor Summer Air Cooling Mini Fan;No URL;Not Ranked;Not Included;"400+ ";9.90;0
Vehicle-Mounted Vacuum Cleaner Super Suction Super High Power Wet And Dry Cleaning Cat Hair Pet Hair Multi-Functional Portable Mini-Handheld In-Car Corded Cable Vacuum Cleaner For All Vehicles With Cigarette Lighter Socket;No URL;Not Ranked;Not Included;"600+ ";12.60;0
New Wireless Electric Single-Head Double-Bar USB Electric Mixer, Mini Cream Automatic Beater For Home Use, Cake Baking, Handheld Rechargeable, High Power Quick Mixing Food Blender, Electric Egg Beater (White/Black);No URL;Not Ranked;Not Included;"100+ ";9.90;0
Electric Kettle, Stainless Steel Kettle, Household Electric Kettle;No URL;10;in Electric Kettles;0;17.30;0
1pc, Mini Portable Foldable Fan With Spray Humidifier USB Rechargeable Handheld Fan With Water Mist, Cooling Comfort For Indoor & Outdoor Travel, Living Room Classroom, School Bedroom, Office Outdoor Sports, Picnic Travel, Summer Essential, Beach Vacation Essential Back To School Supplies;No URL;Not Ranked;Not Included;"1.200+ ";7.30;0
Mini Makeup Brush, Eyelashes Cleaner Device Electric Automatic Washing Machine Sponge Cleaning Toy For Girls Ladies. Cute And Helpful: To Wash Your Makeup Brushes, Sponge, Powder Puff. 1pc Automatic Cleaning Washing Machine For Makeup Brush Sponge Eyelash, Makeup Tool Cleaner With Dry Bucket For Makeup Tool, Makeup Sponge Washing Machine, Deep Clean Mini Washing Machine, Electronic Washing Machine For Makeup Sponge, Powder Puffs;No URL;Not Ranked;Not Included;"100+ ";5.80;0
1pc Mini Kitchen Baking Coffee Food Electronic Scale I2000, Square, Suitable For Home Cooking (Without Battery);No URL;2;in Digital Kitchen Scales;0;8.30;0
Professional Ionic Hair Dryer,1800W Quick Dry Low Noise Hair Dryer With 2 Concentrator Nozzles, 1 Diffuser Attachment For Home Lightweight Travel Hairdryer Salon Hair Blow Dryer Hair Care Gift;No URL;2;in Hair Dryers;0;25.50;4
PANCERKA 1 Set Electric Spin Scrubber With 5 Replaceable Brush Head, TYPE-C Rechargeable Power Cord Electric Cleaning Brush, Three-Speed Adjustable Handheld Shower Scrubber For Bathroom, Kitchen, Bathtub, Tile, Shower, Cleaning Supplies;No URL;Not Ranked;Not Included;"10+ ";7.25;59
16QT Air Fryer Toaster Oven Combo, 4-Slice Convection Oven With Air Fryer Function, Warm, Broil, Toast, Bake, Oil-Free Cooking, Includes Accessories, Stainless Steel;No URL;Not Ranked;Not Included;0;117.99;21
1pc Wooden Roller Massage Stick, Legs, Back, Belly, Limbs, Neck And More Can Be Used, White Nine Wheels, Red Nine Wheels, Multiple Colors Available;No URL;Not Ranked;Not Included;"40+ ";7.20;0
Mini Usb Mouse Shaped Uv Lamp For Nail Art, With Gel Polish And Top/base Coat, No Dark Skin, Fast Drying And Long Lasting;No URL;Not Ranked;Not Included;"300+ ";2.80;0
1pc Smart Temperature Display Insulated Coffee Cup, Stainless Steel Portable Travel Mug, Double Wall Vacuum Insulated Cooler Mug For Hot And Cold Drinks, Holiday Gifts;No URL;Not Ranked;Not Included;"200+ ";9.40;7
Round Air Fryer Parchment Paper, Oil-absorbing And Non-stick, Suitable For Baking And Roasting In Air Fryer;No URL;10;in Air Fryers;0;3.80;0
1pc Household Floor Sweeper,Upgrade Hand-Pushed Sweeping Robot With Dustpan Set - 2 In 1 Machine For Hardwood Surfaces, Wood Floors, Laminate, Tile - Small & Portable Broom, Cleans Dust Pet Hair, Manual Hand Push Mop Vacuum Cleaner;No URL;Not Ranked;Not Included;"100+ ";23.90;0
Wireless Usb Rechargeable Electric Water Pump Dispenser, Portable Pure Drinking Water Bottled Switch, Two Use For Home Office Kitchen Outdoor, Black & White, Size: 130*90*65mm/5.11*3.54*2.55inch;No URL;1;in Water and Ice Dispensers;0;6.40;0
1pc Dragon & Phoenix Pattern Rechargeable Men's Hair Clipper, ABS Material, Portable & Professional For Home & Travel Use;No URL;2;in Hair Clippers;0;3.40;0
2-In-1 Salt And Pepper Grinder Set, Double-Head Spice Grinder, Manual Pepper Mill -Household Sea Salt Ginder, Stainless Steel Spice Grinder, Manual Pepper Mill, Spice Crusher, Reusable Spice Bottle For BBQ Picnic Camping, Kitchen Gadgets, Gifts, Dorm Essentials, Back To School Supplies;No URL;4;in Electric Salt & Pepper Grinders;0;6.40;0
1pc Rechargeable  S2509 Electric Shaver Three-Dimensional Floating Cutterhead 1 Hour Fast Charging 50-Minute Battery Life;No URL;Not Ranked;Not Included;0;42.70;0
Mini Handheld Fan With 5 Speeds Wind Display, Portable & Quiet Fan For Office Desktop, Dorm Room, Rechargeable & Hand-held Fan For Outdoor Use;No URL;Not Ranked;Not Included;"1.800+ ";7.90;0
1pc Mini Portable Fan, Handheld Fan Personal Mini Fan USB Rechargeable With 5 Speeds, 90° Foldable Battery Operated Mini Fan With LED Display, Desk Fan Working Time For Office Bedroom Outdoor Travel Camping Back To School Supplies;No URL;Not Ranked;Not Included;"20+ ";8.20;0
Teckwe Fabric Shaver Lint Remover For Clothes,Mini Portable Hair Ball Trimmer Sweater Defuzzer Remove Fuzz,Lint Balls,Pills,Bobbles From Clothes,Furniture,Carpet,Couch (Batteries Not Included);No URL;Not Ranked;Not Included;"100+ ";3.29;35
Telescopic USB Rechargeable Foldable Portable Mini Fan For Dormitory Outdoor Activities, Portable USB Fan;No URL;Not Ranked;Not Included;"100+ ";21.20;0
1pc Portable Stroller Fan Flexible Tripod Clip On Fan With 3 Speeds And Rotatable Handheld Personal Fan For Car Seat Crib Bike Treadmill;No URL;Not Ranked;Not Included;"200+ ";9.10;0
1pc Italian Style  Espresso Maker - Aluminum Moka Pot for Strong and Flavored Coffee - Easy to Operate and Clean;No URL;Not Ranked;Not Included;"100+ ";13.40;0
1pc ABS Portable Charging Electric Eyebrow Trimmer Women's Eyebrow Pencil Automatic Eyebrow Knife Facial Hair Removal Beauty Trimmer Lipstick Shaver;No URL;Not Ranked;Not Included;"90+ ";2.90;3
Professional All-in-one Hair Drying Brush, Hot Air Brush, Hair Dryer Brush, Hair Styling Brush For Drying, Curling And Modeling Hair;No URL;4;in Hair Straightening Irons;0;17.40;0
Bladeless Halter Fan Slouchy, Silent, Portable Mini Foldable Fan With Three Speeds And Long Battery Life;No URL;Not Ranked;Not Included;"20+ ";6.30;0
1pc Compact And Portable Battery-Free High Quality Plastic Thermometer Hygrometer, White Circle Shape, Physically Induced High Precision Temperature And Humidity Measurement, Suitable For Home/Office/Warehouse/Laboratory/Greenhouse, For All Seasons;No URL;Not Ranked;Not Included;0;5.30;0
Wireless Vacuum Cleaner With Strong Suction Power And Multi-Functional Handheld Design - Suitable For Home, Commercial, Car, Industrial And Outdoor Use - Can Be Used For Cleaning Floors And As A Dust Collector;No URL;Not Ranked;Not Included;"100+ ";13.88;22
Desktop Leafless Fan Home Office Tower Fan Floor Leafless Tower Fan USB Rechargeable Portable Tower Fan;No URL;4;in Exhaust Fans;0;12.90;0
Silently Cool The Air Anywhere: Portable, Durable Mini Fan With High Performance USB Rechargeable Battery - Your Convenient Cool Companion;No URL;Not Ranked;Not Included;"2.600+ ";5.00;0
Multifunctional Cleaner, Makeup Storage Cleaning, Jewelry Cleaning, Silverware Cleaning, Suitable For Glasses, Rings, Earrings, Necklaces, Watch Straps, Makeup Brushes;No URL;1;in Ultrasonic Cleaners;0;6.00;6
Versatile 5-In-1 Electric Epilator For Painless Hair Removal - Precision Trimmer For Bikini, Eyebrow & Body - Portable & Battery-Operated For Home And Travel Use;No URL;Not Ranked;Not Included;"60+ ";4.23;10
3 Barrels Hair Curling Roll Ceramic Iron 22Mm Temperature Adjustable Portable 3 Barrels Wave Iron Wand Curler Diy Curly Hair Styling Tools Gift;No URL;3;in Curling Tongs & Curling Wands;0;11.23;8
Household Handheld Egg White Cream Electric Mixer;No URL;4;in Hand Blenders;0;15.30;0
1 Piece Automatic Curling Lron, Electric Heatedhair Curler, Automatical Rotating Curling Lronsportable Heated Hair Styling Tool For Home,Salon, Barbershop, Beauty Products Curling Wand;No URL;6;in Curling Tongs & Curling Wands;0;25.70;4
PANCERKA Electric Vegetable Chopper & Mini Food Processor, Electric Food Chopper 1.5-Cup, For Dicing, Mincing, And Puree, Black;No URL;4;in Blenders;0;20.50;0
Vacuum Sealer Machine With Dry/Wet/External Vacuum System Modes, Led Display, Automatic And Manual Options For Food Storage And Air Sealing;No URL;8;in Vacuum Food Sealers;0;18.09;10
1pc Rechargeable 500mAh Battery Portable Handheld Mini Fan With 3 Adjustable Speed Levels;No URL;Not Ranked;Not Included;"60+ ";3.30;8
1pc Multi-Functional Anti-Gravity Humidifier With Clock, Night Light, And Ornament - Enhance Your Home's Atmosphere And Health;No URL;Not Ranked;Not Included;"30+ ";26.00;0
PANCERKA Steamer For Clothes, Garment Steamer, Handheld Garment Steamer, Portable Fabric Steamer, Clothes Wrinkle Remover, Home Ironing Machine, Suitable For Travel And Home Use - Fast Heating;No URL;8;in Laundry Appliances;0;15.72;28
Slow Masticating Juicer Cold Press Juice Extractor Apple Orange Citrus Juicer Machine with Wide Chute Quiet Motor for Fruit Vegetables;No URL;4;in Juicer & Food Processor;0;78.10;0
MINI Fascia Gun Men's And Women's Creative Pocket Machine Portable Meridians Massage Parlor Electric Health Equipment Mini Fascia Gun,Massage Gun;No URL;Not Ranked;Not Included;"80+ ";15.90;0
1200mah Rechargeable Foldable Desktop Fan/Wall-Mounted Fan/Portable Air Conditioner, Foldable Fan, Table Fan, Mini Portable Fan, Suitable For Office, Home, Kitchen, Outdoor, 90° Adjustable, Quiet Operation, With Trackless Hook, Three Adjustable Speeds;No URL;Not Ranked;Not Included;"400+ ";14.70;0
1 Pc USB Charging Electric Juicer 350ml Mini Portable Blender Fruit Mixers Fruit Extractors Multifunction Juice Maker Machine Blender Smoothies Mixer;No URL;Not Ranked;Not Included;"30+ ";25.30;0
Rechargeable Handheld Mini Fan Small Desk Cooler Portable Air Conditioner Student Cute Mini Electric Fan Handheld Mute  Aire Aconditionado;No URL;Not Ranked;Not Included;"1.700+ ";5.00;0
Jewelry Cleaner Machine,Ultrasonic Jewelry Cleaner Machine Low Noise Ultrasound Silver Jewelry Cleaner For Retainer,Eyeglass,Watches,Coins,Dentures … …;No URL;6;in Ultrasonic Cleaners;0;7.80;0
Electric Toothbrush For Adults,  Toothbrush With 3 Modes, USB Rechargeable Electric Toothbrush With 4 Brush Heads & 31,000 VPM Deep Clean Waterproof IPX7-White;No URL;Not Ranked;Not Included;0;38.10;8
1pc Stainless Steel Whisk;No URL;Not Ranked;Not Included;"100+ ";1.30;0
1 Pocket Foldable Handheld Electric Fan, Rechargeable, Foldable, Handheld Small Fan, Portable Fan, Mini Handheld Fan, USB Handheld Small Pocket Fan;No URL;Not Ranked;Not Included;"1.900+ ";4.20;0
1pc Portable Digital Kitchen Scale;No URL;Not Ranked;Not Included;"300+ ";6.20;0
1pc Planet Humidifier Light, 3 Color LED Humidifier For Home Decor;No URL;Not Ranked;Not Included;"400+ ";11.30;0
Professional Barber Hair Clipper, Rechargeable Electric Cutting Machine Beard Trimmer Shaver Razor For Men Cutter;No URL;3;in Hair Clippers;0;11.90;0
1pc 28mm Plastic Spiral Curling Iron, Modern Two Tone Hair Curler For Home;No URL;3;in Electric Hair Brushes;0;9.30;0
1pc 120ML Steamer For Clothes, Portable Handheld Steam Iron, 6 Round Steam Vent For 30 Minutes Of Continuous Steaming, Fabric Wrinkle Remover Steam Iron For Home, Office And Travel;No URL;Not Ranked;Not Included;"1.400+ ";15.44;31
Electric milk frother Handheld Milk Frother Mini Foamer - Mini Drink Mixer for Hot Coffee, Electric Whisk With Stand, Coffee Mixer Wand, Drink Mixer Handheld for Lattes, Cappuccino;No URL;Not Ranked;Not Included;"50+ ";7.60;0
Mini Cartoon Bird Design Onion Humidifier, 300ml, Home/office/desktop Air Conditioning Room Moisturizing Device;No URL;Not Ranked;Not Included;"200+ ";8.30;0
5L Stainless Steel Electric Cooking Machine with 6-Leaf Pure Steel Knife - Fast Meat Mincer, Chopper, Garlic Mud Maker, Food Supplement, Juice and Noodle Machine - Multi-Purpose Kitchen Appliance;No URL;7;in Kitchen Meat Grinders;0;33.30;0
1pc Usb Rechargeable Led Display Halter Fan, Portable Bladeless Turbine Silent Slouchy Neck Fan;No URL;Not Ranked;Not Included;"100+ ";15.50;3
Yabano Sandwich Maker, Waffle Maker, Toaster and Electric Panini Press Grill with Non-stick Coating Plate, Easy to Clean, Heating Up Fast, Black;No URL;Not Ranked;Not Included;"200+ ";27.99;60
Rechargeable 4-In-1 Electric Razor For Women - Painless Hair Trimmer For Face, Nose, Eyebrows, Beard, Mustache, Arm, Leg, Armpit, And Bikini - Portable Body Shavers Set Rechargeable Grooming Kit Perfect Personal Care Tool;No URL;7;in Women Shave & Hair Removal Appliances;0;10.44;10
6l Mini-Foldable Washing Machine, Bucket-Type, Portable, Fully Automatic, With Washing And Dewatering Functions (No Drainpipe);No URL;Not Ranked;Not Included;"1.000+ ";19.80;25
Portable Multi-Functional Food Processor-Blender With Pulse Button Design For Kitchen, Easy Operation And Better Control Of Cutting Effect, Dual Speed;No URL;Not Ranked;Not Included;0;25.85;50
WantJoin Commercial Professional Blender With Shield Quiet Sound Enclosure 2200W Industries Strong and Quiet Professional-Grade Power, Self-Cleaning, Silver;No URL;Not Ranked;Not Included;0;259.99;13
1pc Rechargeable PQ889 Electric Shaver Mini Washable Portable Organiser 1 Hour Battery Life;No URL;Not Ranked;Not Included;0;86.40;0
1pc, Plug In Electric Mosquito Repellent Lamp For Household Use, Silent And Non Radiative, Electric Mosquito Catching And Repellent Device, Pest Control, Apartment Essentials, College Dorm Essentials, Household Gadgets Electric Mosquito Killer Lamp For Home Bedroom;No URL;Not Ranked;Not Included;0;5.22;20
1pc Heart & Flower Shaped Random Egg Ring;No URL;Not Ranked;Not Included;"50+ ";1.60;0
