1pc Smart Mini Dehumidifier For Home Use In Bedrooms, Wardrobes, Cameras, Etc.;No URL;6;in Dehumidifiers;0;6.90;0
20000mAh Camping Fan With Dual Motor , Battery Operated Fan With 4 LED Lantern, 8 Speeds Desk Fan With Remote, Portable Outdoor Fan With Hook For Tent, Power Outages, Jobsite;No URL;Not Ranked;Not Included;"200+ ";35.99;22
720 LCD Myofascial Gun 1200mAh USB Rechargeable Updated Myofascial Gun Muscle Relaxation Massager With 4 Massage Heads And 6 Levels Of Speed, Touch Control Button, Suitable For Office Workers For Relaxation After Exercise For Athletes And Fitness Enthusiasts;No URL;Not Ranked;Not Included;"20+ ";16.25;5
1 Set, Sourdough Starter Jar For Bakery, For Sourdough Bread Baking, Sourdough Starter Kit With Date Marked Feeding Band, Thermometer, Scraper, Sourdough Container Sewn Cloth Cover & Metal Lid, Baking Accessories;No URL;Not Ranked;Not Included;0;13.60;0
Manual Rotary Cheese Grater With Wide Hopper And 3 Interchangeable Blades, Kitchen Gadget For Cheese, Vegetables, Potatoes And Nuts, Vegetable Slicer, Multifunctional Fruit Slicer, Vegetable Cutter With Container, Onion Chopper With Multiple Interchangeable Blades, Home Potato Julienne Cutter;No URL;Not Ranked;Not Included;0;18.10;0
Stovetop Espresso Cup Moka Pot - 3 Cup;No URL;Not Ranked;Not Included;"40+ ";13.64;0
3pcs Professional Hair Clipper Set, USB Rechargeable Electric Razor Fine Cutter Beard Trimmer Razor,Barber Trimming Machine Set,Cordless Hair Cutting Machine For Men;No URL;Not Ranked;Not Included;"20+ ";15.05;50
Portable Battery-Operated Red Hair Trimmer Electric Epilator Eyebrow Shaping Tool, Mini Facial Hair Remover, Face Shaver For Women, Using 1pc AA Battery;No URL;3;in Epilators;0;3.00;0
1pc Portable Handheld Fan With Rechargeable 500mah Lithium Battery, Silicon Strap, Type-C Charging Port, Cute Cartoon Design And 3-Speed Settings;No URL;Not Ranked;Not Included;"200+ ";4.40;4
1pc Egg Holder, Ceramic Cute Dog Shape Novelty Container Egg Stand, For Kitchen Dinning Table;No URL;Not Ranked;Not Included;0;8.40;0
Stay Cool On-The-Go: 1pc Portable USB Mini Fan;No URL;Not Ranked;Not Included;"3.700+ ";4.80;0
Handheld Massager 20 Speed Wand Vibrating Massage Magic Full Body Therapy Motor;No URL;Not Ranked;Not Included;0;17.99;74
5-Layer Stainless Steel Kitchen Scissors - Multifunctional Onion And Herb Chopper For BBQ And Indoor Use - Durable, Safe, With Protective Cover And Built-In Cleaner;No URL;Not Ranked;Not Included;0;3.26;52
1pc Mini LED Electronic Finger Counter, Portable Buddhist Prayer Beads Counting Ring, Manual And Precise;No URL;Not Ranked;Not Included;0;0.80;50
1pc Battery Sphygmomanometer (4 X 7 Batteries), Cuff Upper Arm Sphygmomanometer, Digital Display, Suitable For Home Use, Easy To Carry On The Go.;No URL;1;in Oximeter & Blood Pressure Meter;0;11.20;0
1pc Rechargeable/battery Operated Electric Toothbrush With 6-speed Adjustable Settings And 6 Brush Heads;No URL;6;in Oral Care Appliances;0;3.40;0
Women's Lipstick Portable Electric Shaver;No URL;Not Ranked;Not Included;"30+ ";2.60;10
Usb Rechargeable Desktop Mini Fan With Telescopic Feature, Adjustable In 3 Speeds;No URL;Not Ranked;Not Included;"1.500+ ";9.10;7
"HOMCOM 32"" Mobile Evaporative Air Cooler, 3-In-1 Ice Cooling Fan Water Conditioner Humidifier Unit With Remote, Timer, Oscillating, LED Display, 3.2gal Water Tank For Home Office Bedroom";No URL;Not Ranked;Not Included;"80+ ";81.99;34
Roll On Wax, Wax Roller Kit For Hair Removal, Roller Waxing Kit Include 2 Soft Wax Cartridge & 100 Non-Woven Wax Strips & 10 Wax Removing And Moisturizing Wipes, Portable Pink Wax Heater Machine For Women & Men, Waxing Roller Kit Depilatory Wax For Sensitive Skin;No URL;8;in Wax Heaters;0;17.30;0
Portable Cordless Hair Straightener Brush,Portable Straightening Brush With Negative Lon,Hot Comb Hair Straightener For Women, Lightweight & Mini To Carry Out;No URL;Not Ranked;Not Included;"10+ ";15.70;0
1pc Rechargeable Portable Handheld Single Speed Outdoor Simple Mini Fan With Lanyard;No URL;Not Ranked;Not Included;"600+ ";4.50;2
1pc Manual Coffee/Tea Separation Brewing French Press;No URL;Not Ranked;Not Included;0;10.20;0
All-In-One Men's Electric Shaver, Multi-Function Razor With LCD Display, USB Charging And Three Different Blades, Suitable For Car Usage;No URL;Not Ranked;Not Included;"20+ ";2.90;3
1ps Rechargeable 10ml Intelligent Car Fragrance Machine Ultrasonic Atomization Automatic Start Stop Car Air Vent Fragrance Machine;No URL;Not Ranked;Not Included;"300+ ";2.60;0
1pc 3-In-1 USB Rechargeable Vacuum Sealer - Portable Electric PumpElectric Mini Vacuum Pump For Kitchen Storage, Sous Vide And Meal Preparation Preserves Fresh Food And Reduces Waste;No URL;Not Ranked;Not Included;0;7.60;0
1pc Little Flower Humidifier Usb Mini Portable Silent Water Cup Office Home Air Humidifier Water Mist Maker, Red Nano Steamer Facial Steamer Humidifier, Unclogs Pores Spray Facial Steamer Skin Care Tool;No URL;Not Ranked;Not Included;"50+ ";2.09;37
Portable Washing Machine 11L Large Capacity, Mini Foldable Washing Machine With Spin Dryer, Small Collapsible Laundry Washer For Travel, Apartment, Underwears, Socks, Baby Clothes (Purple);No URL;10;in Portable Washing Machines;0;38.53;28
GW Hair Dryer Salon Performance AC Motor Styling Tool/Hair Dryer Professional Blow Dryer Fast Drying For Hair Care / 2 Speed/Cold, For Home Travel Hotel;No URL;Not Ranked;Not Included;"400+ ";11.30;0
1pc Household Electronic Kitchen Scale, Mini Baking Scale, Small Food Scale, Digital Weight Scale, Kitchen Weighing Scale (In Kilograms),Kitchen,Party,Camping,Room Decor,Kitchen Items,Kitchen Portable.;No URL;Not Ranked;Not Included;0;6.20;0
MACchine Electric Pulse Massager Muscle Stimulator Pain Relief Therapy;No URL;Not Ranked;Not Included;"20+ ";17.99;5
Body Hair Trimmer For Men, Electric Ball Trimmer Men, Groin Shaver For Men, Pubic Hair Groomer, Wet Dry Grooming Machine, Replaceable Ceramic Male Hygiene Razor For Full Body Grooming, Professional Cordless Hair Cutting Clippers;No URL;Not Ranked;Not Included;0;14.09;19
1pc Juicer Portable Small Charging Juicer Cup Household Customization Multifunctional Juicer Juicer Cup;No URL;Not Ranked;Not Included;0;12.30;12
1pc Wall Plug Mobile Range Hood,3-Gears;No URL;Not Ranked;Not Included;0;13.35;46
Desktop Fan Cooling Air Conditioner Small Size USB Powered, Silent Fan Bedroom Dormitory Office Cooling Artifact Mini Air Conditioner New Style Oscillating Large Wind Force Silent Room;No URL;Not Ranked;Not Included;"50+ ";14.20;0
1PC Compact Multi-Function Refrigerator For Skincare/Cosmetics, Food And Beverages, Portable Mini Fridge For Car And Home;No URL;Not Ranked;Not Included;0;44.48;28
Electronic Acupuncture Pen, Acupressure Therapy Pen, Intelligent Meridian Massager, Muscle Relief Massage Pen;No URL;Not Ranked;Not Included;"10+ ";8.80;0
5 In 1 Women'S Electric Hair Removal Epilator Trimmer For Bikini, Eyebrow, Beard, No Battery Included Electric Hair Depilator;No URL;Not Ranked;Not Included;"200+ ";3.40;6
1pc Retractable Foldable Desktop Fan, USB Powered, 6 Inches, Quiet, For Office Desk;No URL;Not Ranked;Not Included;"10+ ";7.60;12
1pc Ultrasonic Skin Scrubber Beauty Device With EMS Micro-Current, Blackhead Dead Skin Remover, Face Cleansing Instrument;No URL;Not Ranked;Not Included;0;11.50;0
New Portable Battery-Operated Electric Toothbrush With 30 Second Timer, Sonic Electric Toothbrush For Oral Health - Suitable For Both Men And Women - Effectively Clean Teeth And Gums, Comes With 1 Handle And 6 Replacement Brush Heads, Ultra Soft Bristles For Sensitive Teeth And Gums;No URL;Not Ranked;Not Included;"300+ ";2.07;31
1pc Cat Design Electric Fan, Pink Small Handheld Fan For Outdoor;No URL;Not Ranked;Not Included;"300+ ";3.06;10
Multifunctional Curling Iron Hair Curling Wands Electric Fast Heating Hair Curling Iron Anti Scalding Design Hair Styling Tools (0.35IN,0.51IN,0.86IN,0.98IN,1.10IN,1.25IN) Mother's Day Gift;No URL;5;in Curling Tongs & Curling Wands;0;13.50;4
Painless And Safe USB Rechargeable Electric Hair Removal For Women - Full Body Shaver With Lipstick Shape;No URL;Not Ranked;Not Included;0;4.00;0
Black Wired Car Vacuum Cleaner With Storage Bag;No URL;7;in Car Vacuum Cleaner;0;23.70;0
Upgrade Your Kitchen With This Rechargeable Electric Pepper Grinder Set - Automatic, Adjustable, Dustproof, And LED Light!;No URL;Not Ranked;Not Included;0;14.94;55
1pc Mini USB Rechargeable Fan, Suitable For Home & Outdoor Use;No URL;Not Ranked;Not Included;"300+ ";3.50;0
1 Set Of 2 Batteries, Size 5, Mini Electric Blackhead Remover, Blackhead Remover, Pore Cleaner, 3 Types Of Suction Heads, 2 Levels Of Adjustable Strength, Facial Cleaning, Black Small Particles, Acne, And Blackheads, Keeping The Face Clean And Refreshing;No URL;Not Ranked;Not Included;0;5.80;0
Professional Hair Trimmer Set Hair Clippers Cordless Hair Trimmer Electric Barber Clippers Zero Gapped Trimmer Professional Beard Trimmer Rechargeable Hair Cutting Kit , Gift Set;No URL;Not Ranked;Not Included;"200+ ";11.00;0
1pc 12inches Sun Metal Thermometer, Four Seasons Garden Decor Golden Decor Battery Free Decor Thermometer, Festival Gift&Home, For Outdoor, Porch, Foyer, Living Room, Fence;No URL;5;in Temperature Gauges;0;8.87;27
1 Set 3-In-1 Vacuum Food Sealer, Save Sealer, USB Rechargeable Handheld Pump, For Sous Vide And Food Storage, With 10 Reusable Zipper Vacuum Bags, Compatible With Anova Joule Sous Vide Machine;No URL;Not Ranked;Not Included;0;5.20;0
1pc 7 Steel Ball Abdominal Massager| Handheld Ball Massager Beauty Meridian Brush Kneads Abdomen Slender Waist Beautiful Legs Muscle Relaxation;No URL;Not Ranked;Not Included;"90+ ";2.96;56
Hair Clipper Electric Pusher Haircut Machine Electric Clipper Oil Head Carving Razor For Bald Head Haircut;No URL;Not Ranked;Not Included;"80+ ";2.90;3
Steam Hair Straightener Flat Iron Professional Ceramic Tourmaline 2-In-1 Straightening Iron, Adjustable 300-450F Salon Heat,  Dual Voltage, Black;No URL;Not Ranked;Not Included;"30+ ";23.60;4
Havato Nugget Ice Maker Countertop,  Self-Cleaning  Ice Maker With Ice Basket & Scoop, 26Lbs/24H, 9 Ice Cubes Ready In 6 Mins, Chewable Ice Maker Machine For Home Camping Party RV;No URL;Not Ranked;Not Included;"30+ ";71.99;45
Hair Clipper For Men, Hair Cutting Machine, Beard Trimmer ,Cordless Barber Clipper With LED Display;No URL;Not Ranked;Not Included;"40+ ";10.90;4
Portable Wireless EMS Home Fitness Massage Trainer For 1pc Arm And 1pc Abdomen (With 2pcs Hosts Without Battery);No URL;Not Ranked;Not Included;"80+ ";6.10;0
1 Handheld Fan, 2000mAh Power Bank, Small Flashlight, Pocket Fan, Portable Battery Powered Or USB Powered Foldable Personal Fan, 3-Speed, Female Gift, Male Gift, Children's Holiday Gift;No URL;Not Ranked;Not Included;"10+ ";9.90;0
A 1.5 Liter Portable Heating And Thermal Insulation Lunch Box, Lunch Box Kids,Lunch Box Men,Lunch Box Insulated,Lunch Box Electric,Lunch Box Women,Lunch Box For Boys,Lunch Box Girls,Lunch Box For Women,Lunch Box Containers,Lunch Box For Men,Bento Box For Kids,Bento Box Stainless,Bento Box With ,Bento Box With Bag,Bento Box With Utensils,Bento Box Office,Bento Box Food,Bento Box Portable,Bento Box Handle,Bento Box Dividers,Bento Box Lunch,Bento Box Kitchen,Bento Box Camping Bag,Bento Box O;No URL;5;in Electric Lunch Boxes;0;18.24;40
1pc Kitchen Timer, Digital Countdown Timer, Stand Timer, Cooking Timer, No Battery Needed, Teacher Timer, Easy-To-Use Timer, Kitchen Accessory, Dorm Essential, Small Kitchen Tool.;No URL;Not Ranked;Not Included;"10+ ";1.86;40
Ceramic Automatic Hair Straightener 320'F- 428'F Temperature, For AllHairstyles Straightener Fast Heating Multifunctional Hair StraightenerHair Styling Tool For Dry Or Wet Hair(US);No URL;5;in Hair Straightening Irons;0;11.00;4
Led Makeup Mirror With Light Desktop Stand, Portable Cosmetic Mirror With Light;No URL;Not Ranked;Not Included;"100+ ";7.60;4
Portable Blender,Christmas Gift Shakes And Smoothies Waterproof Blender USB Rechargeable With 20 Oz Blender Cups With Travel Lid.;No URL;Not Ranked;Not Included;"100+ ";27.99;47
Rechargeable Hair Trimmer For Split Ends, Portable Electric Automatic Haircut Machine For Household Use Gift;No URL;Not Ranked;Not Included;"500+ ";17.10;10
Turbo Mini Fan, Handheld & Desktop Stand Dual Use, Powerful Wind;No URL;Not Ranked;Not Included;"400+ ";2.15;40
1pc Portable ABS Beauty Machine, Modern 7 Color Light Led Wrinkle Tighten Skin Care Beauty Machine For Home;No URL;Not Ranked;Not Included;"30+ ";19.30;0
Portable Air Conditioner,Cooler,Desktop Fan USB Electric Fan Telescopic Folding Small Fan USB Charging Student Dormitory Office Desktop Mute Large Fan;No URL;Not Ranked;Not Included;"40+ ";36.40;0
10pcs Self Adhesive 3.5mm Electrode Pads 5.5x8cm Replacement Gel Pads TENS EMS Massage Pad For Pulse Massager Muscle Stimulator;No URL;Not Ranked;Not Included;"200+ ";4.00;0
1pc USB Fan Mini Portable Desktop Fan Quiet Office Fan With Multi-Angle 3D Cooling Handheld Fan Air Conditioner Cooler Gift For Students Or Home Use In Summer;No URL;Not Ranked;Not Included;"20+ ";3.50;8
4d Multifunctional Electric Shaver, Rechargeable, Waterproof, Electric Head Hair Shaver Men's Beard Trimming Tool;No URL;Not Ranked;Not Included;"100+ ";8.69;14
Hair Clipper Electric Pusher Haircut Machine Electric Clipper Oil Head Carving Razor For Bald Head Haircut;No URL;Not Ranked;Not Included;"3.500+ ";3.20;0
1pc/3pcs/6pcs Silicone Sealing Ring O-Ring 600W/900W Juice Extractor Blender Accessory Nutriblender Replacement Part,Kitchen Portable Fruit Machine,Portable Juicer And Blender,Juice,Lemon.;No URL;Not Ranked;Not Included;"10+ ";1.60;0
1pc 7 Colors Flame Simulation Ultrasonic Humidifier With Aromatherapy And Lighting - USB Powered Essential Oil Diffuser For Bedroom And Travel ,H2o Air Fire Flame Humidifier  Oil Diffuser Humidifier School Supplies, Back To School;No URL;Not Ranked;Not Included;0;13.50;0
IPL Hair Removal For Women At-Home,Upgraded To 999,000 Flashes Painless Hair Remover,Facial Hair Removal Device For Armpits Legs Arms Bikini Line;No URL;Not Ranked;Not Included;0;55.99;44
Mini Lightweight Portable Full Body Electric Massager;No URL;Not Ranked;Not Included;"20+ ";7.60;0
Kitchen Scale Mini Household Weight Scale Baking Food Scale Electronic Kitchen Scale;No URL;Not Ranked;Not Included;0;5.52;40
1 Unit, USB Data Cable Power Supply 220ml Ultrasonic Mini Air Humidifier Aromatic Diffuser Household Car Office Humidifier With LED Night Light Freshener Product Size: Height 4.05in * Width 3.14in;No URL;Not Ranked;Not Included;"300+ ";2.90;0
Electric Trimmer For Removing Lip Hair, Nose Hair, Underarm, And Private Parts For Both Men And Women;No URL;Not Ranked;Not Included;"200+ ";6.90;4
300ml Aroma Diffuser For Essential Oil Large Room, Ultrasonic Humidifier With 8 Color Lights, 3 Timer Setting, Auto Shut-Off;No URL;Not Ranked;Not Included;"10+ ";16.10;0
Mini Electric Lint Remover, Battery-Operated Fabric Shaver;No URL;Not Ranked;Not Included;"20+ ";6.40;0
1pc Rechargeable Portable Handheld Heart Shaped Fruit Fan With Cellphone Holder Function;No URL;Not Ranked;Not Included;"1.500+ ";4.50;4
Professional Mens Hair Clippers Zero Gapped Cordless Hair Trimmer Professional Haircut & Grooming Kit For Men Rechargeable LED Display;No URL;2;in Electric Shavers;0;7.33;42
New Arrival Electric Handheld Massage Hammer With Vibration & Kneading Function, Cordless Design;No URL;Not Ranked;Not Included;0;15.60;9
1pc Cartoon Mini Portable Bear Calculator With LED Large Screen Display Creative Keychain Calculator;No URL;Not Ranked;Not Included;0;2.00;0
"VEVOR 14"" 1500W Electric Countertop Flat Top Griddle 110V Non-Stick Commercial Electric Griddles Restaurant Teppanyaki Grill Stainless Steel Adjustable Temperature Control 122°F-572°F, Sliver";No URL;9;in Electric Grills & Electric Griddles;0;81.99;20
1pc Portable Handheld Fan With Hand Rope, Battery Operated (Batteries Not Included), 1 Speed Level;No URL;Not Ranked;Not Included;"100+ ";3.00;0
1pc, Dual Power Supply (Plug-In And Battery), LED Double-Sided Foldable Makeup Mirror, Requires 4 AAA Batteries, 10x Magnifying Mirror On Both Sides, Desktop Vanity Light, With Lipstick Storage;No URL;Not Ranked;Not Included;0;9.10;3
1pc+Type-C USB+4000mAh+5V/2A+Emergency Power Bank Function+Digital Display+Portable+Folding+Desktop, Neck Hanging, Upright, Handheld Cooling Fan+5-Speed Strong Wind+H08+Brushless Motor Mini Fan;No URL;Not Ranked;Not Included;0;17.10;0
1pc Planet Design Humidifier;No URL;Not Ranked;Not Included;0;13.00;0
Neck Fan, 4 Turbos Foldable Portable Fan, 6000mAh Bladeless Neck Fan Rechargeable, LED Display, 3 Speeds Adjustment, 360°Cooling Airflow For Office, Outdoor, Travel, Home;No URL;Not Ranked;Not Included;"40+ ";23.99;40
WANAI Compact Refrigerator 3.5 CU.FT Double Door Mini Fridge With Freezer Small Refrigerator With 7 Adjustable Temperature Side Door Wire Rack Suit For Dorm Office Apartment Black;No URL;Not Ranked;Not Included;"20+ ";189.99;27
Portable Fan, Handheld Fan Personal Mini Fan 3000mAh Rechargeable With 5 Speeds, Battery Operated Mini Fan With LED Display, 11-21Hs Desk Fan Working Time For Office Bedroom Outdoor Travel Camping;No URL;Not Ranked;Not Included;"100+ ";10.10;0
HOMCOM Mini Freezer Countertop, 1.1 Cu.Ft Compact Upright Freezer With Removable Shelves, Reversible Door For Home, Dorm, Apartment And Office, Gray;No URL;Not Ranked;Not Included;0;126.99;34
WANAI Small Refrigerator With Freezer 3.5 Cu.Ft Mini Fridge With Freezer On Top Double Door Small Fridge For Bedroom Dorm Room College Office Valentines Black;No URL;Not Ranked;Not Included;0;174.99;24
6pcs/Set Faucet Water Filter ,  Water Purification, Faucet Multi -Function Filtration, Enjoy Clean Water, Malls Hotels Home Outdoor RV Universal Model Replaceable Filter, For Hotel Restaurant Purified Water;No URL;6;in Water Filter Cartridges;0;4.47;16
EMS  Massage Device Muscle Training Device  Massage  Belt Abdomen Waist Instrument Smart Sculpting Abdomen Belt;No URL;Not Ranked;Not Included;0;11.00;0
1pc Multifunctional High Power Home Car Vacuum Cleaner With Inflator, Wireless Tyre Inflator, Portable Pet  Vacuum Cleaner For Car & Home Use;No URL;2;in Vacuum Cleaners;0;21.20;0
Stainless Steel Cold Water Pitcher, European Style For Home, Restaurant Or Hotel. It Is Suitable As A Gift For Business Opening. Please Do Not Use It To Boil Water.;No URL;Not Ranked;Not Included;0;12.50;0
Smart Watch Health Monitoring Bluetooth Call Watch Exercise Heart Rate Blood Oxygen;No URL;Not Ranked;Not Included;0;12.20;28
Electric Wine Decanter, Quick Intelligent Wine Pourer, With An Automatic One-Click Dispenser And A Second Press Stopper. Built-In Air Intake To Simultaneously Air The Wine While Pouring, Saving 15-20 Minutes. Fully Charged, It Can Pour Above 30 Bottles Of Red Wine.;No URL;Not Ranked;Not Included;0;8.55;10
1pc New Automatic Hair Trimmer, Hair Clippers, Unisex Grooming, Portable Hair Shaver With Blue Light Hair Care Function, Surprise Gift For Women's Festival;No URL;Not Ranked;Not Included;"80+ ";18.90;4
Fascia Gun Muscle Massager Portable Fitness Muscle Relaxer Exercise Recovery Mini Electric Massage Gun;No URL;Not Ranked;Not Included;"80+ ";5.76;37
Desktop Cooling Fan USB Office Home Desktop Spray Water Cooler Mini Air Conditioning Fan;No URL;Not Ranked;Not Included;"60+ ";21.22;32
Electric Makeup Brush Cleaner And Dryer - Quick And Easy Cleaning And Drying In One Minute - 8 Rubber Tube Sleeves For Optimal Brush Care;No URL;Not Ranked;Not Included;0;14.20;0
Portable Handheld Fan With Desktop Base, 3 Adjustable Speeds, Rechargeable Battery, Mini Usb Fan For Office/Travel/Outdoor/Camping/Reading, Grey;No URL;Not Ranked;Not Included;"90+ ";4.90;0
Professional Hair Curling Iron Ceramic Triple Barrel Hair Curler Irons Hair Wave Waver Styling Tools Hair Styler Wand Heated Styling Iron Brush Fast Heating Hair Wand Curler In All Hair Type;No URL;Not Ranked;Not Included;"200+ ";14.10;3
Pink Set Generation 2 Rechargeable Hair Trimmer, Split Ends Hair Cutter, Household 2-In-1 Portable Hair Clippers, Electric Hair Cutting Tool With Hair Clipper;No URL;Not Ranked;Not Included;"200+ ";14.20;16
1pc Stainless Steel Visual Kitchen Timer With Magnetic Back Countdown Reminder For Cooking Baking Alarm Clock;No URL;Not Ranked;Not Included;0;6.40;0
1PC Portable Wireless Handheld Car Vacuum Cleaner, Mini, For Home And Car Use;No URL;Not Ranked;Not Included;"10+ ";4.80;50
angenil Argan Oil Flat Iron Curling Iron In One, Professional Portable Dual Voltage Ceramic Hair Straightener, 1.6 Inch Wide Flat Iron For Thick Hair, Fast Straightening Styling, Lcd Display;No URL;3;in Hair Straightening Irons;0;28.60;0
Powerful Portable Electric Food Chopper & Processor Made Of 304 Stainless Steel - Mini Usb Wireless Handheld Garlic Slicer With 350ml Capacity, Made Of Plastic, Suitable For Vegetables & Meat;No URL;Not Ranked;Not Included;"80+ ";10.60;20
4-In-1 Handheld Blender Set, Including Multi-Function Stick Blender, Whisk, Chopper And Beaker, Suitable For Food Processing & Baby Food Mixing;No URL;7;in Meat Grinders;0;34.80;0
Women'S Depilator Shaver For Leg, Body, Face, Bikini Line Trimming, Electric Hair Depilator Wet And Dry Use Home Use Shaver Tool;No URL;Not Ranked;Not Included;"100+ ";7.41;22
1pc Yunbaoit Rainbow Visual Timer - 60 Min Countdown, Night Light, Whisper-Quiet, Classroom & Kitchen Timer For Home, School & Office;No URL;Not Ranked;Not Included;0;7.60;50
5in1 Multifunctional Hot Airbrush Curling & Straightening Ionizing Hair Dryer For Styling;No URL;Not Ranked;Not Included;"20+ ";24.30;2
Multifunctional Electric Shaver For Men, With Razor, Hair Clipper,Rechargeable Hair Clipper Trimmer Kit Digital Display Men's Trimmer Men's Trimmer Shaver Portable Haircut Machine For Man, Mens Grooming Kit;No URL;Not Ranked;Not Included;"300+ ";9.40;4
1pc Rechargeable 1800mAh Outdoor Portable Mini Fan With Neck Lanyard, Waist Clip & Table Stand, 5 Speeds, Natural Wind, Power Display, With Hanging Rope;No URL;Not Ranked;Not Included;"30+ ";11.30;0
A Type-C Rechargeable Handheld Fan With 5-Speed Level LED Display, 180° Foldable & 5-Blade High Velocity Fan. Choose From Three Colors.;No URL;Not Ranked;Not Included;0;8.10;5
Foot Grinder, Electric Callus Remover, Foot File Grinder Pedicure Tool With Speed Controller And 20pcs Replacement Sandpaper Disk For Men Women Dead Dry Crack Skin Calluses;No URL;Not Ranked;Not Included;"20+ ";24.10;5
Compact UV LED Nail Lamp: Hypoallergenic, USB-Powered, Fast-Drying & Portable For On-The-Go Manicures, With Rechargeable Lithium Battery;No URL;Not Ranked;Not Included;0;3.70;0
K26 Cute Cartoon Neck-Hanging Fan, Portable, 3-Speed, Strong Wind, Long-Lasting, Lightweight, Rechargeable, For Outdoor Activities, Hand-Held, Dormitory, And Office Creative Gift;No URL;Not Ranked;Not Included;"20+ ";10.00;0
Black Electric Coffee Grinder;No URL;Not Ranked;Not Included;0;18.24;40
Multi-Functional Juicer Household Automatic Juicer Separation Small Portable Orange Juice Cup USB Charging;No URL;Not Ranked;Not Included;"50+ ";18.45;10
Household Kitchen Scale Stainless Steel Weighing Scale For Food Diet Balance Measuring LCD Precision Electronic Scales 10Kg;No URL;Not Ranked;Not Included;"200+ ";9.60;0
Toaster 2 Slice, Extra Wide Slot, Stainless Steel, 7 Browning Shade Settings, Bagel/Gluten-Free/Reheat Function, Variable Browning Control, 900 Watt;No URL;Not Ranked;Not Included;"10+ ";26.89;0
Largner Professional Hair Clippers For Men- Hair Cutting Kit & Zero Gap T-Blade Trimmer Combo- Cordless Barber Clipper Set With Led Display For Mens Gifts(Black);No URL;Not Ranked;Not Included;"100+ ";30.60;4
"Automatic Hair Curler, Ceramic Ionic Barrel Automatic Hair Curling Iron, Auto Curling Wand With 1"" Large Rotating Barrel & 4 Temps & 3 Timer Settings, Dual Voltage Spin Iron For Hair Styling";No URL;Not Ranked;Not Included;"20+ ";24.00;4
Hair Curling Comb Electric Curler Professional Styling Tools Hot Comb Hair Straightener Brush For All Hair Types, Green, Purple, Valentines Day, St Patrick Day, Mother's Day Gift 110V;No URL;Not Ranked;Not Included;"100+ ";7.80;36
Teckwe Hair Straightener,Beauty Heating Salon Flat Iron,Quick Warm-Up & LCD Display,Long-Lasting Hold And Smooth Hair & 1h Smart Shut Down For Home Travel - US Plug;No URL;Not Ranked;Not Included;0;25.49;35
2 Doors Cold-Rolled Sheet Compact Refrigerator;No URL;9;in Portable Refrigerator;0;291.99;29
LARGNER Men Electric Shaver 3D Floating Razor Washable Rechargeable Electric Razor Triple Blade Beard Trimmer Whole Body Wash USB Travel Charger - Perfect Gift For Boyfriend Or Father;No URL;Not Ranked;Not Included;"50+ ";6.10;5
Pink Electric Massage Gun For Relieving Muscle Stiffness And Soreness;No URL;Not Ranked;Not Included;"10+ ";9.70;0
1pc PP Food Mixer, Multifunctional Household Hand Mixer For Kitchen;No URL;Not Ranked;Not Included;"70+ ";25.90;0
Mini USB Fan Portable Fans Metal Cooler Cooling 4 Blades Desktop Mute Fans Silent Universal For Car Notebook Computer Desk Fan;No URL;Not Ranked;Not Included;"500+ ";5.70;22
Cartoon Modeling Yellow Duck Kitchen Mechanical Timer Baking Management Time Timing Alarm Reminder For Restaurant For Restaurant/Food Truck/Bakery;No URL;Not Ranked;Not Included;0;4.10;0
Electric Razor For Men, Dry&Wet 3D Mens Electric Shaver , Rechargeable Rotary Shaving Machines , Father's Day Gift For Father Dad Men Husband Boyfriend;No URL;Not Ranked;Not Included;"100+ ";16.00;4
Wholesale Electronic Rechargeable Body Weight Scale, Household Precision Digital Weight Scale;No URL;Not Ranked;Not Included;0;11.57;43
4-In-1 Handheld Blender Set, Including Multi-Function Stick Blender, Whisk, Chopper And Beaker, Suitable For Food Processing & Baby Food Mixing;No URL;8;in Hand Blenders;0;38.90;0
Kitchen Scale Electronic Scale Baking Food Gram Measuring Scale Kitchen Electronic Scale Food Weighing Device Commercial Scale;No URL;Not Ranked;Not Included;0;6.78;40
